
############## annie - 03/04/21 15:05:54 EST -0500 ##############

############## annie - 03/04/21 15:05:54 EST -0500 ##############


############## annie - 03/30/21 00:20:37 EST -0500 ##############

2021-03-31 00:00:57 284 packets transmitted, 282 received, 0% packet loss, time 84920209ms
2021-03-31 00:00:57 rtt min/avg/max/mdev = 29.304/79.115/239.814/52.061 ms

############## annie - 04/02/21 00:20:39 EST -0500 ##############

2021-04-03 00:01:09 284 packets transmitted, 283 received, 0% packet loss, time 84929160ms
2021-04-03 00:01:09 rtt min/avg/max/mdev = 30.295/57.511/240.200/39.551 ms

############## annie - 04/04/21 00:20:43 EST -0500 ##############

2021-04-05 00:01:12 284 packets transmitted, 281 received, 1% packet loss, time 84929464ms
2021-04-05 00:01:12 rtt min/avg/max/mdev = 30.834/58.327/201.353/37.623 ms

############## annie - 04/05/21 00:20:44 EST -0500 ##############

2021-04-06 00:01:03 284 packets transmitted, 283 received, 0% packet loss, time 84918961ms
2021-04-06 00:01:03 rtt min/avg/max/mdev = 27.388/65.563/188.284/44.471 ms

############## annie - 04/09/21 13:52:37 EST -0500 ##############

############## annie - 04/09/21 13:52:37 EST -0500 ##############


############## annie - 04/09/21 14:21:29 EST -0500 ##############

############## annie - 04/09/21 14:21:29 EST -0500 ##############


############## annie - 04/10/21 00:20:44 EST -0500 ##############

2021-04-11 00:01:38 284 packets transmitted, 278 received, 2% packet loss, time 84954566ms
2021-04-11 00:01:38 rtt min/avg/max/mdev = 29.249/90.385/229.993/56.736 ms

############## annie - 04/13/21 00:20:48 EST -0500 ##############

2021-04-14 00:01:27 284 packets transmitted, 278 received, 2% packet loss, time 84938495ms
2021-04-14 00:01:27 rtt min/avg/max/mdev = 32.278/89.975/1360.059/105.912 ms

############## annie - 04/16/21 00:20:48 EST -0500 ##############

2021-04-17 00:01:38 284 packets transmitted, 279 received, 1% packet loss, time 84949615ms
2021-04-17 00:01:38 rtt min/avg/max/mdev = 32.499/90.994/242.865/57.745 ms

############## annie - 04/17/21 00:20:51 EST -0500 ##############

2021-04-18 00:01:55 284 packets transmitted, 277 received, 2% packet loss, time 84964039ms
2021-04-18 00:01:55 rtt min/avg/max/mdev = 29.948/100.370/208.303/56.777 ms

############## annie - 04/19/21 00:20:48 EST -0500 ##############

2021-04-20 00:01:20 284 packets transmitted, 281 received, 1% packet loss, time 84932169ms
2021-04-20 00:01:20 rtt min/avg/max/mdev = 31.848/62.914/179.131/39.277 ms

############## annie - 04/20/21 00:20:49 EST -0500 ##############

2021-04-21 00:02:15 284 packets transmitted, 276 received, 2% packet loss, time 84986780ms
2021-04-21 00:02:15 rtt min/avg/max/mdev = 32.827/76.097/249.883/51.511 ms

############## annie - 04/23/21 00:20:52 EST -0500 ##############

2021-04-24 00:01:27 284 packets transmitted, 282 received, 0% packet loss, time 84935340ms
2021-04-24 00:01:27 rtt min/avg/max/mdev = 31.835/73.059/223.437/50.423 ms

############## annie - 04/25/21 00:20:51 EST -0500 ##############

2021-04-26 00:01:39 284 packets transmitted, 279 received, 1% packet loss, time 84947758ms
2021-04-26 00:01:39 rtt min/avg/max/mdev = 28.807/103.299/221.306/58.634 ms

############## annie - 04/29/21 00:20:53 EST -0500 ##############

2021-04-30 00:01:39 284 packets transmitted, 275 received, 3% packet loss, time 84945846ms
2021-04-30 00:01:39 rtt min/avg/max/mdev = 32.380/105.419/834.907/74.042 ms

############## annie - 05/02/21 00:20:55 EST -0500 ##############

2021-05-03 00:01:37 284 packets transmitted, 279 received, 1% packet loss, time 84942150ms
2021-05-03 00:01:37 rtt min/avg/max/mdev = 32.036/111.827/215.199/56.210 ms

############## annie - 05/09/21 00:20:58 EST -0500 ##############

2021-05-10 00:01:32 284 packets transmitted, 280 received, 1% packet loss, time 84933394ms
2021-05-10 00:01:32 rtt min/avg/max/mdev = 29.545/80.416/225.134/53.681 ms

############## annie - 05/14/21 00:20:59 EST -0500 ##############

2021-05-15 00:01:25 284 packets transmitted, 281 received, 1% packet loss, time 84926302ms
2021-05-15 00:01:25 rtt min/avg/max/mdev = 29.880/80.387/199.312/52.739 ms

############## annie - 05/19/21 00:21:00 EST -0500 ##############

2021-05-20 00:01:26 284 packets transmitted, 282 received, 0% packet loss, time 84925690ms
2021-05-20 00:01:26 rtt min/avg/max/mdev = 30.721/54.206/192.806/30.395 ms

############## annie - 05/24/21 00:21:03 EST -0500 ##############

2021-05-25 00:01:54 284 packets transmitted, 281 received, 1% packet loss, time 84951244ms
2021-05-25 00:01:54 rtt min/avg/max/mdev = 31.939/97.054/231.439/58.235 ms

############## annie - 06/05/21 00:21:08 EST -0500 ##############

2021-06-06 00:01:38 284 packets transmitted, 276 received, 2% packet loss, time 84930101ms
2021-06-06 00:01:38 rtt min/avg/max/mdev = 29.850/57.693/219.643/39.747 ms

############## annie - 06/08/21 00:21:09 EST -0500 ##############

2021-06-09 00:01:57 284 packets transmitted, 274 received, 3% packet loss, time 84947542ms
2021-06-09 00:01:57 rtt min/avg/max/mdev = 30.389/79.708/243.771/54.966 ms

############## annie - 06/14/21 12:56:28 EST -0500 ##############

############## annie - 06/14/21 12:56:28 EST -0500 ##############


############## annie - 06/15/21 00:21:10 EST -0500 ##############

2021-06-16 00:08:09 284 packets transmitted, 247 received, 13% packet loss, time 85319168ms
2021-06-16 00:08:09 rtt min/avg/max/mdev = 28.764/72.251/821.017/67.500 ms

############## annie - 06/16/21 12:56:01 EST -0500 ##############

############## annie - 06/16/21 12:56:01 EST -0500 ##############


############## annie - 06/16/21 14:20:47 EST -0500 ##############

############## annie - 06/16/21 14:20:47 EST -0500 ##############


############## annie - 06/19/21 00:21:12 EST -0500 ##############

2021-06-20 00:09:49 284 packets transmitted, 237 received, 16% packet loss, time 85416930ms
2021-06-20 00:09:49 rtt min/avg/max/mdev = 29.766/62.634/221.304/43.780 ms

############## annie - 06/22/21 00:21:16 EST -0500 ##############

2021-06-23 00:02:09 284 packets transmitted, 276 received, 2% packet loss, time 84952281ms
2021-06-23 00:02:09 rtt min/avg/max/mdev = 32.105/67.131/241.214/47.820 ms

############## annie - 06/25/21 00:21:17 EST -0500 ##############

2021-06-26 00:02:04 284 packets transmitted, 279 received, 1% packet loss, time 84946287ms
2021-06-26 00:02:04 rtt min/avg/max/mdev = 30.575/96.979/1086.856/84.068 ms

############## annie - 06/28/21 00:21:18 EST -0500 ##############

2021-06-29 00:01:36 284 packets transmitted, 277 received, 2% packet loss, time 84917272ms
2021-06-29 00:01:36 rtt min/avg/max/mdev = 30.860/59.579/175.441/38.755 ms

############## annie - 06/29/21 00:21:22 EST -0500 ##############

2021-06-30 00:01:41 284 packets transmitted, 282 received, 0% packet loss, time 84918628ms
2021-06-30 00:01:41 rtt min/avg/max/mdev = 31.784/69.573/241.091/46.697 ms

############## annie - 06/30/21 00:21:21 EST -0500 ##############

2021-07-01 00:01:40 284 packets transmitted, 282 received, 0% packet loss, time 84919109ms
2021-07-01 00:01:40 rtt min/avg/max/mdev = 29.972/69.672/217.359/46.287 ms

############## annie - 07/01/21 00:21:20 EST -0500 ##############

2021-07-02 00:01:40 284 packets transmitted, 282 received, 0% packet loss, time 84919710ms
2021-07-02 00:01:40 rtt min/avg/max/mdev = 28.814/58.976/1256.166/79.044 ms

############## annie - 07/02/21 00:21:20 EST -0500 ##############

2021-07-03 00:03:26 284 packets transmitted, 267 received, 5% packet loss, time 85025975ms
2021-07-03 00:03:26 rtt min/avg/max/mdev = 32.956/79.810/1279.935/89.577 ms

############## annie - 07/03/21 00:21:23 EST -0500 ##############

2021-07-04 00:09:23 284 packets transmitted, 240 received, 15% packet loss, time 85380362ms
2021-07-04 00:09:23 rtt min/avg/max/mdev = 27.589/55.196/165.183/36.257 ms

############## annie - 07/08/21 00:21:23 EST -0500 ##############

2021-07-09 00:02:25 284 packets transmitted, 277 received, 2% packet loss, time 84961046ms
2021-07-09 00:02:25 rtt min/avg/max/mdev = 28.092/100.348/1351.460/110.061 ms

############## annie - 07/10/21 00:21:24 EST -0500 ##############

2021-07-11 00:02:32 284 packets transmitted, 278 received, 2% packet loss, time 84967619ms
2021-07-11 00:02:32 rtt min/avg/max/mdev = 31.647/81.937/224.256/55.163 ms

############## annie - 07/13/21 00:21:28 EST -0500 ##############

2021-07-14 00:02:45 284 packets transmitted, 277 received, 2% packet loss, time 84977176ms
2021-07-14 00:02:45 rtt min/avg/max/mdev = 32.231/107.250/219.566/56.765 ms

############## annie - 07/14/21 00:21:24 EST -0500 ##############

2021-07-15 00:04:32 284 packets transmitted, 265 received, 6% packet loss, time 85087440ms
2021-07-15 00:04:32 rtt min/avg/max/mdev = 32.636/100.858/237.326/57.352 ms

############## annie - 07/18/21 00:21:28 EST -0500 ##############

2021-07-19 00:02:09 284 packets transmitted, 280 received, 1% packet loss, time 84941270ms
2021-07-19 00:02:09 rtt min/avg/max/mdev = 29.418/60.631/702.413/54.361 ms

############## annie - 07/19/21 00:21:31 EST -0500 ##############

2021-07-20 00:02:20 284 packets transmitted, 282 received, 0% packet loss, time 84949374ms
2021-07-20 00:02:20 rtt min/avg/max/mdev = 29.071/50.310/169.688/23.878 ms

############## annie - 07/20/21 00:21:31 EST -0500 ##############

2021-07-20 23:56:51 284 packets transmitted, 284 received, 0% packet loss, time 84919993ms
2021-07-20 23:56:51 rtt min/avg/max/mdev = 29.096/69.220/220.703/47.054 ms

############## annie - 07/21/21 00:21:31 EST -0500 ##############

2021-07-21 23:56:51 284 packets transmitted, 284 received, 0% packet loss, time 84919430ms
2021-07-21 23:56:51 rtt min/avg/max/mdev = 28.868/67.468/1120.514/75.676 ms

############## annie - 07/22/21 00:21:30 EST -0500 ##############

2021-07-22 23:56:49 284 packets transmitted, 284 received, 0% packet loss, time 84919270ms
2021-07-22 23:56:49 rtt min/avg/max/mdev = 32.657/65.489/226.095/43.890 ms

############## annie - 07/23/21 00:21:31 EST -0500 ##############

2021-07-24 00:01:52 284 packets transmitted, 283 received, 0% packet loss, time 84920832ms
2021-07-24 00:01:52 rtt min/avg/max/mdev = 28.700/60.105/754.885/68.426 ms

############## annie - 07/24/21 00:21:32 EST -0500 ##############

2021-07-25 00:01:55 284 packets transmitted, 283 received, 0% packet loss, time 84922837ms
2021-07-25 00:01:55 rtt min/avg/max/mdev = 27.855/58.056/276.579/41.073 ms

############## annie - 07/25/21 00:21:34 EST -0500 ##############

2021-07-26 00:02:09 284 packets transmitted, 280 received, 1% packet loss, time 84934969ms
2021-07-26 00:02:09 rtt min/avg/max/mdev = 32.712/51.086/639.977/44.792 ms

############## annie - 07/26/21 00:21:34 EST -0500 ##############

2021-07-27 00:02:34 284 packets transmitted, 280 received, 1% packet loss, time 84959985ms
2021-07-27 00:02:34 rtt min/avg/max/mdev = 26.451/53.263/170.419/31.750 ms

############## annie - 07/27/21 00:21:37 EST -0500 ##############

2021-07-28 00:01:59 284 packets transmitted, 283 received, 0% packet loss, time 84922280ms
2021-07-28 00:01:59 rtt min/avg/max/mdev = 32.063/65.493/213.331/45.025 ms

############## annie - 07/28/21 00:21:34 EST -0500 ##############

2021-07-29 00:02:06 284 packets transmitted, 281 received, 1% packet loss, time 84931815ms
2021-07-29 00:02:06 rtt min/avg/max/mdev = 27.583/46.877/172.238/20.785 ms

############## annie - 07/29/21 00:21:32 EST -0500 ##############

2021-07-30 00:02:01 284 packets transmitted, 281 received, 1% packet loss, time 84928888ms
2021-07-30 00:02:01 rtt min/avg/max/mdev = 32.238/67.908/1453.973/93.567 ms

############## annie - 07/30/21 00:21:33 EST -0500 ##############

2021-07-31 00:02:07 284 packets transmitted, 282 received, 0% packet loss, time 84933639ms
2021-07-31 00:02:07 rtt min/avg/max/mdev = 31.680/50.657/494.731/37.800 ms

############## annie - 07/31/21 00:21:36 EST -0500 ##############

2021-07-31 23:56:54 284 packets transmitted, 284 received, 0% packet loss, time 84918526ms
2021-07-31 23:56:54 rtt min/avg/max/mdev = 28.597/54.712/537.546/47.095 ms

############## annie - 08/01/21 00:21:36 EST -0500 ##############

2021-08-01 23:56:56 284 packets transmitted, 284 received, 0% packet loss, time 84919261ms
2021-08-01 23:56:56 rtt min/avg/max/mdev = 31.663/52.101/168.595/32.532 ms

############## annie - 08/02/21 00:21:38 EST -0500 ##############

2021-08-03 00:02:26 284 packets transmitted, 281 received, 1% packet loss, time 84948105ms
2021-08-03 00:02:26 rtt min/avg/max/mdev = 29.317/56.986/238.229/38.230 ms

############## annie - 08/03/21 00:21:41 EST -0500 ##############

2021-08-04 00:02:21 284 packets transmitted, 281 received, 1% packet loss, time 84939351ms
2021-08-04 00:02:21 rtt min/avg/max/mdev = 29.363/49.287/531.704/37.716 ms

############## annie - 08/04/21 00:21:42 EST -0500 ##############

2021-08-05 00:02:23 284 packets transmitted, 282 received, 0% packet loss, time 84941127ms
2021-08-05 00:02:23 rtt min/avg/max/mdev = 25.486/57.044/925.810/61.291 ms

############## annie - 08/05/21 00:21:36 EST -0500 ##############

2021-08-06 00:02:02 284 packets transmitted, 281 received, 1% packet loss, time 84926033ms
2021-08-06 00:02:02 rtt min/avg/max/mdev = 26.701/52.558/192.239/31.441 ms

############## annie - 08/06/21 00:21:37 EST -0500 ##############

2021-08-07 00:02:26 284 packets transmitted, 281 received, 1% packet loss, time 84949214ms
2021-08-07 00:02:27 rtt min/avg/max/mdev = 28.105/59.969/181.045/41.600 ms

############## annie - 08/07/21 00:21:38 EST -0500 ##############

2021-08-07 23:56:57 284 packets transmitted, 284 received, 0% packet loss, time 84919583ms
2021-08-07 23:56:57 rtt min/avg/max/mdev = 32.567/58.942/227.233/40.927 ms

############## annie - 08/08/21 00:21:40 EST -0500 ##############

2021-08-08 23:56:59 284 packets transmitted, 284 received, 0% packet loss, time 84919212ms
2021-08-08 23:56:59 rtt min/avg/max/mdev = 31.660/56.133/177.582/36.933 ms

############## annie - 08/09/21 00:21:44 EST -0500 ##############

2021-08-09 23:57:03 284 packets transmitted, 284 received, 0% packet loss, time 84918986ms
2021-08-09 23:57:03 rtt min/avg/max/mdev = 28.413/57.893/187.498/38.647 ms

############## annie - 08/10/21 00:21:41 EST -0500 ##############

2021-08-11 00:02:10 284 packets transmitted, 281 received, 1% packet loss, time 84928702ms
2021-08-11 00:02:10 rtt min/avg/max/mdev = 28.086/57.529/1109.092/70.258 ms

############## annie - 08/11/21 00:21:45 EST -0500 ##############

2021-08-12 00:02:41 284 packets transmitted, 280 received, 1% packet loss, time 84956412ms
2021-08-12 00:02:41 rtt min/avg/max/mdev = 28.642/64.751/682.916/54.768 ms

############## annie - 08/12/21 00:21:39 EST -0500 ##############

2021-08-13 00:02:11 284 packets transmitted, 279 received, 1% packet loss, time 84931993ms
2021-08-13 00:02:11 rtt min/avg/max/mdev = 32.846/60.592/748.333/53.322 ms

############## annie - 08/13/21 00:21:40 EST -0500 ##############

2021-08-14 00:02:12 284 packets transmitted, 283 received, 0% packet loss, time 84932044ms
2021-08-14 00:02:12 rtt min/avg/max/mdev = 27.995/62.242/233.841/31.819 ms

############## annie - 08/14/21 00:21:42 EST -0500 ##############

2021-08-15 00:02:04 284 packets transmitted, 283 received, 0% packet loss, time 84921787ms
2021-08-15 00:02:04 rtt min/avg/max/mdev = 26.815/48.297/175.246/25.999 ms

############## annie - 08/15/21 00:21:42 EST -0500 ##############

2021-08-16 00:02:09 284 packets transmitted, 283 received, 0% packet loss, time 84927551ms
2021-08-16 00:02:09 rtt min/avg/max/mdev = 33.452/69.369/237.365/33.253 ms

############## annie - 08/16/21 00:21:43 EST -0500 ##############

2021-08-17 00:02:37 284 packets transmitted, 280 received, 1% packet loss, time 84954769ms
2021-08-17 00:02:37 rtt min/avg/max/mdev = 32.733/56.642/224.598/32.390 ms

############## annie - 08/17/21 00:21:40 EST -0500 ##############

2021-08-18 00:02:35 284 packets transmitted, 281 received, 1% packet loss, time 84954693ms
2021-08-18 00:02:35 rtt min/avg/max/mdev = 27.910/60.122/193.176/38.768 ms

############## annie - 08/18/21 00:21:42 EST -0500 ##############

2021-08-19 00:02:04 284 packets transmitted, 281 received, 1% packet loss, time 84921976ms
2021-08-19 00:02:04 rtt min/avg/max/mdev = 29.113/65.551/1318.971/88.712 ms

############## annie - 08/19/21 00:21:43 EST -0500 ##############

2021-08-20 00:02:10 284 packets transmitted, 283 received, 0% packet loss, time 84926993ms
2021-08-20 00:02:10 rtt min/avg/max/mdev = 30.061/52.628/178.068/29.610 ms

############## annie - 08/20/21 00:21:45 EST -0500 ##############

2021-08-21 00:02:04 284 packets transmitted, 283 received, 0% packet loss, time 84919273ms
2021-08-21 00:02:04 rtt min/avg/max/mdev = 27.790/52.048/171.353/29.841 ms

############## annie - 08/21/21 00:21:48 EST -0500 ##############

2021-08-22 00:02:26 284 packets transmitted, 280 received, +1 errors, 1% packet loss, time 84938074ms
2021-08-22 00:02:26 rtt min/avg/max/mdev = 28.498/49.690/241.123/27.621 ms

############## annie - 08/22/21 00:21:47 EST -0500 ##############

2021-08-23 00:02:15 284 packets transmitted, 281 received, 1% packet loss, time 84927711ms
2021-08-23 00:02:15 rtt min/avg/max/mdev = 31.487/60.248/697.542/58.906 ms

############## annie - 08/23/21 00:21:44 EST -0500 ##############

2021-08-24 00:06:56 284 packets transmitted, 255 received, 10% packet loss, time 85211982ms
2021-08-24 00:06:56 rtt min/avg/max/mdev = 31.886/58.172/242.110/38.564 ms

############## annie - 08/24/21 00:21:45 EST -0500 ##############

2021-08-25 00:02:30 284 packets transmitted, 279 received, 1% packet loss, time 84945098ms
2021-08-25 00:02:30 rtt min/avg/max/mdev = 31.248/54.000/261.971/30.230 ms

############## annie - 08/25/21 00:21:47 EST -0500 ##############

2021-08-26 00:02:37 284 packets transmitted, 279 received, 1% packet loss, time 84950258ms
2021-08-26 00:02:37 rtt min/avg/max/mdev = 28.962/66.840/187.307/43.831 ms

############## annie - 08/26/21 00:21:48 EST -0500 ##############

2021-08-27 00:02:29 284 packets transmitted, 282 received, 0% packet loss, time 84940887ms
2021-08-27 00:02:29 rtt min/avg/max/mdev = 29.479/55.937/705.953/49.369 ms

############## annie - 08/27/21 00:21:51 EST -0500 ##############

2021-08-27 23:57:11 284 packets transmitted, 284 received, 0% packet loss, time 84919552ms
2021-08-27 23:57:11 rtt min/avg/max/mdev = 27.724/45.464/245.301/20.739 ms

############## annie - 08/28/21 00:21:52 EST -0500 ##############

2021-08-28 23:57:12 284 packets transmitted, 284 received, 0% packet loss, time 84919379ms
2021-08-28 23:57:12 rtt min/avg/max/mdev = 28.947/46.986/216.493/24.697 ms

############## annie - 08/29/21 00:21:53 EST -0500 ##############

2021-08-29 23:57:12 284 packets transmitted, 284 received, 0% packet loss, time 84919524ms
2021-08-29 23:57:12 rtt min/avg/max/mdev = 31.343/45.727/163.624/21.735 ms

############## annie - 08/30/21 00:21:48 EST -0500 ##############

2021-08-30 23:57:08 284 packets transmitted, 284 received, 0% packet loss, time 84919409ms
2021-08-30 23:57:08 rtt min/avg/max/mdev = 26.873/47.415/187.754/18.193 ms

############## annie - 08/31/21 00:21:49 EST -0500 ##############

2021-08-31 23:57:09 284 packets transmitted, 284 received, 0% packet loss, time 84919978ms
2021-08-31 23:57:09 rtt min/avg/max/mdev = 32.731/50.410/174.685/22.628 ms

############## annie - 09/01/21 00:21:52 EST -0500 ##############

2021-09-01 23:57:12 284 packets transmitted, 284 received, 0% packet loss, time 84920162ms
2021-09-01 23:57:12 rtt min/avg/max/mdev = 27.270/49.095/157.430/20.486 ms

############## annie - 09/02/21 00:21:53 EST -0500 ##############

2021-09-03 00:02:29 284 packets transmitted, 283 received, 0% packet loss, time 84935599ms
2021-09-03 00:02:29 rtt min/avg/max/mdev = 31.858/61.716/695.227/53.109 ms

############## annie - 09/03/21 00:21:51 EST -0500 ##############

2021-09-03 23:57:11 284 packets transmitted, 284 received, 0% packet loss, time 84919884ms
2021-09-03 23:57:11 rtt min/avg/max/mdev = 27.433/53.102/223.057/29.535 ms

############## annie - 09/04/21 00:21:54 EST -0500 ##############

2021-09-04 23:57:13 284 packets transmitted, 284 received, 0% packet loss, time 84919112ms
2021-09-04 23:57:13 rtt min/avg/max/mdev = 26.085/44.153/181.288/15.802 ms

############## annie - 09/05/21 00:21:57 EST -0500 ##############

2021-09-06 00:02:38 284 packets transmitted, 281 received, 1% packet loss, time 84940927ms
2021-09-06 00:02:38 rtt min/avg/max/mdev = 28.120/44.085/159.487/14.771 ms

############## annie - 09/06/21 00:21:54 EST -0500 ##############

2021-09-06 23:57:13 284 packets transmitted, 284 received, 0% packet loss, time 84919601ms
2021-09-06 23:57:13 rtt min/avg/max/mdev = 30.064/55.461/448.087/42.895 ms

############## annie - 09/07/21 00:21:52 EST -0500 ##############

2021-09-07 23:57:12 284 packets transmitted, 284 received, 0% packet loss, time 84919867ms
2021-09-07 23:57:12 rtt min/avg/max/mdev = 29.456/48.752/170.034/19.338 ms

############## annie - 09/08/21 00:21:51 EST -0500 ##############

2021-09-09 00:02:38 284 packets transmitted, 282 received, 0% packet loss, time 84946984ms
2021-09-09 00:02:38 rtt min/avg/max/mdev = 32.624/51.157/286.382/23.307 ms

############## annie - 09/09/21 00:21:53 EST -0500 ##############

2021-09-09 23:57:13 284 packets transmitted, 284 received, 0% packet loss, time 84919750ms
2021-09-09 23:57:13 rtt min/avg/max/mdev = 27.499/49.386/166.813/19.705 ms

############## annie - 09/10/21 00:21:52 EST -0500 ##############

2021-09-10 23:57:10 284 packets transmitted, 284 received, 0% packet loss, time 84918534ms
2021-09-10 23:57:10 rtt min/avg/max/mdev = 28.159/52.148/174.398/24.950 ms

############## annie - 09/11/21 00:21:52 EST -0500 ##############

2021-09-11 23:57:11 284 packets transmitted, 284 received, 0% packet loss, time 84918725ms
2021-09-11 23:57:11 rtt min/avg/max/mdev = 30.131/52.134/170.572/27.357 ms

############## annie - 09/12/21 00:21:54 EST -0500 ##############

2021-09-13 00:02:26 284 packets transmitted, 283 received, 0% packet loss, time 84931723ms
2021-09-13 00:02:26 rtt min/avg/max/mdev = 31.080/56.638/237.700/37.200 ms

############## annie - 09/13/21 00:21:55 EST -0500 ##############

2021-09-13 23:57:14 284 packets transmitted, 284 received, 0% packet loss, time 84919490ms
2021-09-13 23:57:14 rtt min/avg/max/mdev = 28.299/51.322/169.718/25.410 ms

############## annie - 09/14/21 00:21:58 EST -0500 ##############

2021-09-14 23:57:18 284 packets transmitted, 284 received, 0% packet loss, time 84919587ms
2021-09-14 23:57:18 rtt min/avg/max/mdev = 28.173/49.132/158.869/17.867 ms

############## annie - 09/15/21 00:21:58 EST -0500 ##############

2021-09-15 23:57:18 284 packets transmitted, 284 received, 0% packet loss, time 84919037ms
2021-09-15 23:57:18 rtt min/avg/max/mdev = 30.469/54.472/170.309/27.137 ms

############## annie - 09/16/21 00:21:59 EST -0500 ##############

2021-09-16 23:57:18 284 packets transmitted, 284 received, 0% packet loss, time 84918911ms
2021-09-16 23:57:18 rtt min/avg/max/mdev = 29.247/55.238/224.602/29.909 ms

############## annie - 09/17/21 00:22:03 EST -0500 ##############

2021-09-18 00:02:22 284 packets transmitted, 283 received, 0% packet loss, time 84918974ms
2021-09-18 00:02:22 rtt min/avg/max/mdev = 31.285/48.131/158.140/14.873 ms

############## annie - 09/18/21 00:21:54 EST -0500 ##############

2021-09-19 00:02:54 284 packets transmitted, 277 received, 2% packet loss, time 84959598ms
2021-09-19 00:02:54 rtt min/avg/max/mdev = 30.806/63.415/240.864/44.678 ms

############## annie - 09/19/21 00:22:01 EST -0500 ##############

2021-09-20 00:02:26 284 packets transmitted, 283 received, 0% packet loss, time 84925230ms
2021-09-20 00:02:26 rtt min/avg/max/mdev = 31.007/44.105/159.386/10.351 ms

############## annie - 09/22/21 00:22:00 EST -0500 ##############

2021-09-22 23:57:19 284 packets transmitted, 284 received, 0% packet loss, time 84919489ms
2021-09-22 23:57:19 rtt min/avg/max/mdev = 29.465/47.158/171.658/18.732 ms

############## annie - 09/24/21 00:22:01 EST -0500 ##############

2021-09-24 23:57:20 284 packets transmitted, 284 received, 0% packet loss, time 84919178ms
2021-09-24 23:57:20 rtt min/avg/max/mdev = 28.551/52.638/144.164/15.401 ms

############## annie - 09/25/21 00:21:59 EST -0500 ##############

2021-09-25 23:57:18 284 packets transmitted, 284 received, 0% packet loss, time 84919782ms
2021-09-25 23:57:18 rtt min/avg/max/mdev = 25.685/39.573/95.482/6.685 ms

############## annie - 09/26/21 00:22:00 EST -0500 ##############

2021-09-26 23:57:20 284 packets transmitted, 284 received, 0% packet loss, time 84920384ms
2021-09-26 23:57:20 rtt min/avg/max/mdev = 26.629/39.763/377.091/21.045 ms

############## annie - 09/27/21 00:22:03 EST -0500 ##############

2021-09-27 23:57:22 284 packets transmitted, 284 received, 0% packet loss, time 84919228ms
2021-09-27 23:57:22 rtt min/avg/max/mdev = 26.735/41.976/72.469/7.025 ms

############## annie - 09/28/21 00:22:04 EST -0500 ##############

2021-09-28 23:57:25 284 packets transmitted, 284 received, 0% packet loss, time 84920582ms
2021-09-28 23:57:25 rtt min/avg/max/mdev = 27.447/42.848/457.614/25.727 ms

############## annie - 09/29/21 00:21:59 EST -0500 ##############

2021-09-29 23:57:18 284 packets transmitted, 284 received, 0% packet loss, time 84919359ms
2021-09-29 23:57:18 rtt min/avg/max/mdev = 26.296/40.613/65.123/6.669 ms

############## annie - 09/30/21 00:21:59 EST -0500 ##############

2021-09-30 23:57:21 284 packets transmitted, 284 received, 0% packet loss, time 84920998ms
2021-09-30 23:57:21 rtt min/avg/max/mdev = 26.665/40.917/83.346/7.467 ms

############## annie - 10/01/21 00:22:00 EST -0500 ##############

2021-10-01 23:57:20 284 packets transmitted, 284 received, 0% packet loss, time 84920028ms
2021-10-01 23:57:20 rtt min/avg/max/mdev = 29.300/41.068/93.674/7.137 ms

############## annie - 10/02/21 00:22:01 EST -0500 ##############

2021-10-02 23:57:21 284 packets transmitted, 284 received, 0% packet loss, time 84919489ms
2021-10-02 23:57:21 rtt min/avg/max/mdev = 27.598/38.875/70.720/5.253 ms

############## annie - 10/03/21 00:22:04 EST -0500 ##############

2021-10-04 00:02:38 284 packets transmitted, 283 received, 0% packet loss, time 84933235ms
2021-10-04 00:02:38 rtt min/avg/max/mdev = 29.509/41.026/76.593/6.561 ms

############## annie - 10/04/21 00:22:06 EST -0500 ##############

2021-10-04 23:57:26 284 packets transmitted, 284 received, 0% packet loss, time 84919926ms
2021-10-04 23:57:26 rtt min/avg/max/mdev = 27.450/44.898/219.925/17.146 ms

############## annie - 10/05/21 00:22:07 EST -0500 ##############

2021-10-05 23:57:26 284 packets transmitted, 284 received, 0% packet loss, time 84918859ms
2021-10-05 23:57:26 rtt min/avg/max/mdev = 25.868/42.146/76.069/7.582 ms

############## annie - 10/06/21 00:22:03 EST -0500 ##############

2021-10-06 23:57:22 284 packets transmitted, 284 received, 0% packet loss, time 84919366ms
2021-10-06 23:57:22 rtt min/avg/max/mdev = 28.930/42.452/99.228/9.332 ms

############## annie - 10/07/21 00:22:02 EST -0500 ##############

2021-10-07 23:57:21 284 packets transmitted, 284 received, 0% packet loss, time 84919591ms
2021-10-07 23:57:21 rtt min/avg/max/mdev = 27.678/42.790/70.299/7.421 ms

############## annie - 10/08/21 00:22:04 EST -0500 ##############

2021-10-08 23:57:25 284 packets transmitted, 284 received, 0% packet loss, time 84920715ms
2021-10-08 23:57:25 rtt min/avg/max/mdev = 26.135/41.582/69.570/6.796 ms

############## annie - 10/09/21 00:22:05 EST -0500 ##############

2021-10-09 23:57:24 284 packets transmitted, 284 received, 0% packet loss, time 84919683ms
2021-10-09 23:57:24 rtt min/avg/max/mdev = 26.821/41.104/72.406/7.168 ms

############## annie - 10/11/21 00:22:02 EST -0500 ##############

2021-10-11 23:57:22 284 packets transmitted, 284 received, 0% packet loss, time 84920373ms
2021-10-11 23:57:22 rtt min/avg/max/mdev = 26.241/42.410/113.790/8.890 ms

############## annie - 10/12/21 00:22:04 EST -0500 ##############

2021-10-12 23:57:24 284 packets transmitted, 284 received, 0% packet loss, time 84920713ms
2021-10-12 23:57:24 rtt min/avg/max/mdev = 27.390/42.485/72.432/7.404 ms

############## annie - 10/13/21 00:22:04 EST -0500 ##############

2021-10-13 23:57:24 284 packets transmitted, 284 received, 0% packet loss, time 84919730ms
2021-10-13 23:57:24 rtt min/avg/max/mdev = 28.191/45.600/664.175/37.653 ms

############## annie - 10/14/21 00:22:05 EST -0500 ##############

2021-10-14 23:57:25 284 packets transmitted, 284 received, 0% packet loss, time 84919502ms
2021-10-14 23:57:25 rtt min/avg/max/mdev = 27.847/41.901/93.178/7.103 ms

############## annie - 10/15/21 00:22:09 EST -0500 ##############

2021-10-15 23:57:29 284 packets transmitted, 284 received, 0% packet loss, time 84919484ms
2021-10-15 23:57:29 rtt min/avg/max/mdev = 26.945/41.389/74.612/6.941 ms

############## annie - 10/16/21 00:22:08 EST -0500 ##############

2021-10-17 00:02:27 284 packets transmitted, 283 received, 0% packet loss, time 84919108ms
2021-10-17 00:02:27 rtt min/avg/max/mdev = 27.097/38.391/80.058/4.755 ms

############## annie - 10/17/21 00:22:08 EST -0500 ##############

2021-10-17 23:57:27 284 packets transmitted, 284 received, 0% packet loss, time 84919281ms
2021-10-17 23:57:27 rtt min/avg/max/mdev = 27.538/37.587/54.659/4.343 ms

############## annie - 10/18/21 00:22:09 EST -0500 ##############

2021-10-18 23:57:28 284 packets transmitted, 284 received, 0% packet loss, time 84919269ms
2021-10-18 23:57:28 rtt min/avg/max/mdev = 26.805/41.292/82.809/7.533 ms

############## annie - 10/19/21 00:22:08 EST -0500 ##############

2021-10-19 23:57:29 284 packets transmitted, 284 received, 0% packet loss, time 84920074ms
2021-10-19 23:57:29 rtt min/avg/max/mdev = 25.438/43.091/257.424/15.654 ms

############## annie - 10/20/21 00:22:08 EST -0500 ##############

2021-10-20 23:57:27 284 packets transmitted, 284 received, 0% packet loss, time 84919698ms
2021-10-20 23:57:27 rtt min/avg/max/mdev = 27.620/45.662/227.161/14.401 ms

############## annie - 10/21/21 00:22:07 EST -0500 ##############

2021-10-21 23:57:28 284 packets transmitted, 284 received, 0% packet loss, time 84920392ms
2021-10-21 23:57:28 rtt min/avg/max/mdev = 29.985/44.482/77.577/8.392 ms

############## annie - 10/22/21 00:22:10 EST -0500 ##############

2021-10-22 23:57:31 284 packets transmitted, 284 received, 0% packet loss, time 84920292ms
2021-10-22 23:57:31 rtt min/avg/max/mdev = 27.573/41.044/77.239/7.440 ms

############## annie - 10/23/21 00:22:12 EST -0500 ##############

2021-10-23 23:57:32 284 packets transmitted, 284 received, 0% packet loss, time 84920265ms
2021-10-23 23:57:32 rtt min/avg/max/mdev = 26.589/39.716/265.162/14.544 ms

############## annie - 10/24/21 00:22:10 EST -0500 ##############

2021-10-24 23:57:29 284 packets transmitted, 284 received, 0% packet loss, time 84919396ms
2021-10-24 23:57:29 rtt min/avg/max/mdev = 28.543/38.494/63.910/4.596 ms

############## annie - 10/25/21 00:22:10 EST -0500 ##############

2021-10-25 23:57:30 284 packets transmitted, 284 received, 0% packet loss, time 84919675ms
2021-10-25 23:57:30 rtt min/avg/max/mdev = 25.947/42.909/182.055/11.105 ms

############## annie - 10/26/21 00:22:13 EST -0500 ##############

2021-10-26 23:57:33 284 packets transmitted, 284 received, 0% packet loss, time 84920087ms
2021-10-26 23:57:33 rtt min/avg/max/mdev = 27.306/42.409/164.254/11.240 ms

############## annie - 10/27/21 00:22:08 EST -0500 ##############

2021-10-27 23:57:29 284 packets transmitted, 284 received, 0% packet loss, time 84921063ms
2021-10-27 23:57:29 rtt min/avg/max/mdev = 29.405/40.036/65.570/5.779 ms

############## annie - 10/28/21 00:22:10 EST -0500 ##############

2021-10-28 23:57:30 284 packets transmitted, 284 received, 0% packet loss, time 84920076ms
2021-10-28 23:57:30 rtt min/avg/max/mdev = 27.001/42.476/79.582/8.544 ms

############## annie - 10/29/21 00:22:10 EST -0500 ##############

2021-10-29 23:57:29 284 packets transmitted, 284 received, 0% packet loss, time 84919485ms
2021-10-29 23:57:29 rtt min/avg/max/mdev = 26.499/44.786/360.061/24.410 ms

############## annie - 10/30/21 00:22:10 EST -0500 ##############

2021-10-30 23:57:29 284 packets transmitted, 284 received, 0% packet loss, time 84919643ms
2021-10-30 23:57:29 rtt min/avg/max/mdev = 27.991/40.096/77.835/6.387 ms

############## annie - 10/31/21 00:22:12 EST -0500 ##############

2021-10-31 23:57:32 284 packets transmitted, 284 received, 0% packet loss, time 84919369ms
2021-10-31 23:57:32 rtt min/avg/max/mdev = 27.758/38.618/59.471/4.834 ms

############## annie - 11/01/21 00:22:15 EST -0500 ##############

2021-11-01 23:57:34 284 packets transmitted, 284 received, 0% packet loss, time 84918994ms
2021-11-01 23:57:34 rtt min/avg/max/mdev = 27.325/40.236/71.278/7.230 ms

############## annie - 11/02/21 00:22:13 EST -0500 ##############

2021-11-02 23:57:32 284 packets transmitted, 284 received, 0% packet loss, time 84919398ms
2021-11-02 23:57:32 rtt min/avg/max/mdev = 28.660/41.627/136.455/8.635 ms

############## annie - 11/03/21 00:22:14 EST -0500 ##############

2021-11-03 23:57:34 284 packets transmitted, 284 received, 0% packet loss, time 84920298ms
2021-11-03 23:57:34 rtt min/avg/max/mdev = 28.315/40.537/76.259/7.473 ms

############## annie - 11/04/21 00:22:18 EST -0500 ##############

2021-11-04 23:57:38 284 packets transmitted, 284 received, 0% packet loss, time 84919734ms
2021-11-04 23:57:38 rtt min/avg/max/mdev = 26.116/40.647/149.602/9.169 ms

############## annie - 11/05/21 00:22:12 EST -0500 ##############

2021-11-05 23:57:32 284 packets transmitted, 284 received, 0% packet loss, time 84919454ms
2021-11-05 23:57:32 rtt min/avg/max/mdev = 27.942/41.471/92.645/7.996 ms

############## annie - 11/06/21 00:22:15 EST -0500 ##############

2021-11-06 23:57:35 284 packets transmitted, 284 received, 0% packet loss, time 84919460ms
2021-11-06 23:57:35 rtt min/avg/max/mdev = 26.476/38.727/57.423/4.471 ms

############## annie - 11/07/21 00:22:16 EST -0500 ##############

2021-11-07 23:57:36 284 packets transmitted, 284 received, 0% packet loss, time 84920563ms
2021-11-07 23:57:36 rtt min/avg/max/mdev = 26.138/38.020/53.426/4.051 ms

############## annie - 11/08/21 00:22:17 EST -0500 ##############

2021-11-09 00:02:52 284 packets transmitted, 283 received, 0% packet loss, time 84935703ms
2021-11-09 00:02:52 rtt min/avg/max/mdev = 27.329/41.048/67.753/6.316 ms

############## annie - 11/09/21 00:22:20 EST -0500 ##############

2021-11-10 00:02:53 284 packets transmitted, 283 received, 0% packet loss, time 84933239ms
2021-11-10 00:02:53 rtt min/avg/max/mdev = 26.661/40.712/71.553/6.162 ms

############## annie - 11/10/21 00:22:23 EST -0500 ##############

2021-11-10 23:57:42 284 packets transmitted, 284 received, 0% packet loss, time 84919291ms
2021-11-10 23:57:42 rtt min/avg/max/mdev = 27.320/40.146/79.326/6.773 ms

############## annie - 11/11/21 00:22:20 EST -0500 ##############

2021-11-11 23:57:40 284 packets transmitted, 284 received, 0% packet loss, time 84919586ms
2021-11-11 23:57:40 rtt min/avg/max/mdev = 26.807/41.911/81.336/7.735 ms

############## annie - 11/12/21 00:22:22 EST -0500 ##############

2021-11-12 23:57:42 284 packets transmitted, 284 received, 0% packet loss, time 84919577ms
2021-11-12 23:57:42 rtt min/avg/max/mdev = 27.712/39.967/65.003/5.818 ms

############## annie - 11/13/21 00:22:18 EST -0500 ##############

2021-11-13 23:57:38 284 packets transmitted, 284 received, 0% packet loss, time 84919540ms
2021-11-13 23:57:38 rtt min/avg/max/mdev = 28.381/38.649/83.481/5.469 ms

############## annie - 11/14/21 00:22:19 EST -0500 ##############

2021-11-14 23:57:39 284 packets transmitted, 284 received, 0% packet loss, time 84920216ms
2021-11-14 23:57:39 rtt min/avg/max/mdev = 26.449/39.706/206.550/11.349 ms

############## annie - 11/15/21 00:22:18 EST -0500 ##############

2021-11-15 23:57:39 284 packets transmitted, 284 received, 0% packet loss, time 84920400ms
2021-11-15 23:57:39 rtt min/avg/max/mdev = 28.218/41.579/93.923/8.099 ms

############## annie - 11/16/21 00:22:20 EST -0500 ##############

2021-11-16 23:57:41 284 packets transmitted, 284 received, 0% packet loss, time 84919959ms
2021-11-16 23:57:41 rtt min/avg/max/mdev = 29.205/41.989/161.719/14.180 ms

############## annie - 11/17/21 00:22:23 EST -0500 ##############

2021-11-17 23:57:45 284 packets transmitted, 284 received, 0% packet loss, time 84921864ms
2021-11-17 23:57:45 rtt min/avg/max/mdev = 26.800/41.221/188.707/11.544 ms

############## annie - 11/18/21 00:22:24 EST -0500 ##############

2021-11-18 23:57:43 284 packets transmitted, 284 received, 0% packet loss, time 84918700ms
2021-11-18 23:57:43 rtt min/avg/max/mdev = 26.412/43.904/454.702/27.517 ms

############## annie - 11/19/21 00:22:26 EST -0500 ##############

2021-11-19 23:57:46 284 packets transmitted, 284 received, 0% packet loss, time 84919671ms
2021-11-19 23:57:46 rtt min/avg/max/mdev = 27.815/40.499/170.736/9.930 ms

############## annie - 11/20/21 00:22:29 EST -0500 ##############

2021-11-20 23:57:49 284 packets transmitted, 284 received, 0% packet loss, time 84919887ms
2021-11-20 23:57:49 rtt min/avg/max/mdev = 27.191/40.635/315.551/20.716 ms

############## annie - 11/21/21 00:22:23 EST -0500 ##############

2021-11-21 23:57:44 284 packets transmitted, 284 received, 0% packet loss, time 84920076ms
2021-11-21 23:57:44 rtt min/avg/max/mdev = 26.792/38.727/147.581/10.083 ms

############## annie - 11/22/21 00:22:25 EST -0500 ##############

2021-11-22 23:57:44 284 packets transmitted, 284 received, 0% packet loss, time 84919564ms
2021-11-22 23:57:44 rtt min/avg/max/mdev = 26.946/42.968/301.987/17.720 ms

############## annie - 11/23/21 00:22:28 EST -0500 ##############

2021-11-23 23:57:47 284 packets transmitted, 284 received, 0% packet loss, time 84919712ms
2021-11-23 23:57:47 rtt min/avg/max/mdev = 27.266/42.718/309.894/18.992 ms

############## annie - 11/24/21 00:22:27 EST -0500 ##############

2021-11-24 23:57:47 284 packets transmitted, 284 received, 0% packet loss, time 84920184ms
2021-11-24 23:57:47 rtt min/avg/max/mdev = 25.603/42.302/101.090/8.584 ms

############## annie - 11/25/21 00:22:29 EST -0500 ##############

2021-11-26 00:03:05 284 packets transmitted, 283 received, 0% packet loss, time 84936024ms
2021-11-26 00:03:05 rtt min/avg/max/mdev = 26.710/39.627/287.513/15.615 ms

############## annie - 11/26/21 00:22:30 EST -0500 ##############

2021-11-26 23:57:51 284 packets transmitted, 284 received, 0% packet loss, time 84920768ms
2021-11-26 23:57:51 rtt min/avg/max/mdev = 26.947/38.871/60.731/4.874 ms

############## annie - 11/27/21 00:22:32 EST -0500 ##############

2021-11-27 23:57:51 284 packets transmitted, 284 received, 0% packet loss, time 84919130ms
2021-11-27 23:57:51 rtt min/avg/max/mdev = 26.792/38.822/66.067/4.789 ms

############## annie - 11/28/21 00:22:34 EST -0500 ##############

2021-11-28 23:57:54 284 packets transmitted, 284 received, 0% packet loss, time 84919855ms
2021-11-28 23:57:54 rtt min/avg/max/mdev = 26.266/39.824/230.849/12.564 ms

############## annie - 11/29/21 00:22:29 EST -0500 ##############

2021-11-29 23:57:49 284 packets transmitted, 284 received, 0% packet loss, time 84919792ms
2021-11-29 23:57:49 rtt min/avg/max/mdev = 26.944/41.897/60.527/6.680 ms

############## annie - 11/30/21 00:22:31 EST -0500 ##############

2021-11-30 23:57:51 284 packets transmitted, 284 received, 0% packet loss, time 84919335ms
2021-11-30 23:57:51 rtt min/avg/max/mdev = 27.496/39.653/68.828/5.838 ms

############## annie - 12/01/21 00:22:32 EST -0500 ##############

2021-12-01 23:57:52 284 packets transmitted, 284 received, 0% packet loss, time 84920080ms
2021-12-01 23:57:52 rtt min/avg/max/mdev = 27.746/41.106/72.897/7.053 ms

############## annie - 12/02/21 00:22:36 EST -0500 ##############

2021-12-02 23:57:39 284 packets transmitted, 284 received, 0% packet loss, time 84903049ms
2021-12-02 23:57:39 rtt min/avg/max/mdev = 28.816/64.346/221.012/47.327 ms

############## annie - 12/03/21 00:22:37 EST -0500 ##############

2021-12-04 00:05:51 284 packets transmitted, 267 received, 5% packet loss, time 85094302ms
2021-12-04 00:05:51 rtt min/avg/max/mdev = 27.762/41.331/93.363/7.940 ms

############## annie - 12/04/21 00:22:40 EST -0500 ##############

2021-12-04 23:57:59 284 packets transmitted, 284 received, 0% packet loss, time 84918716ms
2021-12-04 23:57:59 rtt min/avg/max/mdev = 26.817/38.347/60.651/4.586 ms

############## annie - 12/05/21 00:22:37 EST -0500 ##############

2021-12-05 23:57:57 284 packets transmitted, 284 received, 0% packet loss, time 84919668ms
2021-12-05 23:57:57 rtt min/avg/max/mdev = 27.262/38.823/61.573/4.164 ms

############## annie - 12/06/21 00:22:41 EST -0500 ##############

2021-12-06 23:58:00 284 packets transmitted, 284 received, 0% packet loss, time 84918798ms
2021-12-06 23:58:00 rtt min/avg/max/mdev = 28.823/43.303/266.841/17.926 ms

############## annie - 12/07/21 00:22:37 EST -0500 ##############

2021-12-07 23:57:56 284 packets transmitted, 284 received, 0% packet loss, time 84918871ms
2021-12-07 23:57:56 rtt min/avg/max/mdev = 28.866/42.776/83.857/8.554 ms

############## annie - 12/08/21 00:22:36 EST -0500 ##############

2021-12-08 23:57:56 284 packets transmitted, 284 received, 0% packet loss, time 84919186ms
2021-12-08 23:57:56 rtt min/avg/max/mdev = 27.852/41.541/211.105/11.921 ms

############## annie - 12/09/21 00:22:40 EST -0500 ##############

2021-12-09 23:57:59 284 packets transmitted, 284 received, 0% packet loss, time 84919047ms
2021-12-09 23:57:59 rtt min/avg/max/mdev = 26.525/42.426/69.647/7.140 ms

############## annie - 12/10/21 00:22:42 EST -0500 ##############

2021-12-10 23:58:01 284 packets transmitted, 284 received, 0% packet loss, time 84918981ms
2021-12-10 23:58:01 rtt min/avg/max/mdev = 26.460/43.315/255.230/16.493 ms

############## annie - 12/11/21 00:22:43 EST -0500 ##############

2021-12-11 23:58:03 284 packets transmitted, 284 received, 0% packet loss, time 84919789ms
2021-12-11 23:58:03 rtt min/avg/max/mdev = 30.497/39.305/162.249/8.732 ms

############## annie - 12/12/21 00:22:43 EST -0500 ##############

2021-12-12 23:58:04 284 packets transmitted, 284 received, 0% packet loss, time 84920784ms
2021-12-12 23:58:04 rtt min/avg/max/mdev = 27.191/39.333/62.923/5.779 ms

############## annie - 12/13/21 00:22:42 EST -0500 ##############

2021-12-13 23:58:01 284 packets transmitted, 284 received, 0% packet loss, time 84919691ms
2021-12-13 23:58:01 rtt min/avg/max/mdev = 27.782/41.940/77.774/7.817 ms

############## annie - 12/14/21 00:22:45 EST -0500 ##############

2021-12-14 23:58:04 284 packets transmitted, 284 received, 0% packet loss, time 84919475ms
2021-12-14 23:58:04 rtt min/avg/max/mdev = 29.841/38.430/74.342/5.111 ms

############## annie - 12/15/21 00:22:42 EST -0500 ##############

2021-12-15 23:58:03 284 packets transmitted, 284 received, 0% packet loss, time 84920446ms
2021-12-15 23:58:03 rtt min/avg/max/mdev = 27.518/42.084/416.787/23.155 ms

############## annie - 12/16/21 00:22:44 EST -0500 ##############

2021-12-16 23:58:05 284 packets transmitted, 284 received, 0% packet loss, time 84920374ms
2021-12-16 23:58:05 rtt min/avg/max/mdev = 29.418/43.836/173.838/14.377 ms

############## annie - 12/17/21 00:22:46 EST -0500 ##############

2021-12-17 23:58:06 284 packets transmitted, 284 received, 0% packet loss, time 84919299ms
2021-12-17 23:58:06 rtt min/avg/max/mdev = 28.475/40.943/83.013/7.088 ms

############## annie - 12/18/21 00:22:46 EST -0500 ##############

2021-12-18 23:58:05 284 packets transmitted, 284 received, 0% packet loss, time 84918951ms
2021-12-18 23:58:05 rtt min/avg/max/mdev = 26.898/38.169/53.907/4.381 ms

############## annie - 12/19/21 00:22:46 EST -0500 ##############

2021-12-19 23:58:07 284 packets transmitted, 284 received, 0% packet loss, time 84920669ms
2021-12-19 23:58:07 rtt min/avg/max/mdev = 28.808/38.789/66.381/4.542 ms

############## annie - 12/20/21 00:22:51 EST -0500 ##############

2021-12-20 23:58:11 284 packets transmitted, 284 received, 0% packet loss, time 84920250ms
2021-12-20 23:58:11 rtt min/avg/max/mdev = 26.119/42.396/257.764/15.198 ms

############## annie - 12/21/21 00:22:50 EST -0500 ##############

2021-12-21 23:58:10 284 packets transmitted, 284 received, 0% packet loss, time 84920095ms
2021-12-21 23:58:10 rtt min/avg/max/mdev = 27.692/41.951/164.046/10.181 ms

############## annie - 12/22/21 00:22:45 EST -0500 ##############

2021-12-22 23:58:05 284 packets transmitted, 284 received, 0% packet loss, time 84919712ms
2021-12-22 23:58:05 rtt min/avg/max/mdev = 28.630/42.701/453.330/35.547 ms

############## annie - 12/23/21 00:22:48 EST -0500 ##############

2021-12-23 23:58:09 284 packets transmitted, 284 received, 0% packet loss, time 84921130ms
2021-12-23 23:58:09 rtt min/avg/max/mdev = 27.459/41.648/74.037/7.067 ms

############## annie - 12/24/21 00:22:51 EST -0500 ##############

2021-12-24 23:58:10 284 packets transmitted, 284 received, 0% packet loss, time 84919189ms
2021-12-24 23:58:10 rtt min/avg/max/mdev = 28.058/38.732/55.849/4.302 ms

############## annie - 12/25/21 00:22:51 EST -0500 ##############

2021-12-25 23:58:10 284 packets transmitted, 284 received, 0% packet loss, time 84918532ms
2021-12-25 23:58:10 rtt min/avg/max/mdev = 26.837/38.701/71.518/4.738 ms

############## annie - 12/26/21 00:22:50 EST -0500 ##############

2021-12-26 23:58:11 284 packets transmitted, 284 received, 0% packet loss, time 84920818ms
2021-12-26 23:58:11 rtt min/avg/max/mdev = 27.164/38.486/145.247/7.479 ms

############## annie - 12/27/21 00:22:54 EST -0500 ##############

2021-12-27 23:58:14 284 packets transmitted, 284 received, 0% packet loss, time 84920315ms
2021-12-27 23:58:14 rtt min/avg/max/mdev = 25.173/42.163/156.880/11.759 ms

############## annie - 12/28/21 00:22:52 EST -0500 ##############

2021-12-28 23:58:13 284 packets transmitted, 284 received, 0% packet loss, time 84920585ms
2021-12-28 23:58:13 rtt min/avg/max/mdev = 26.356/41.706/140.748/10.898 ms

############## annie - 12/29/21 00:22:57 EST -0500 ##############

2021-12-29 23:58:18 284 packets transmitted, 284 received, 0% packet loss, time 84920239ms
2021-12-29 23:58:18 rtt min/avg/max/mdev = 27.450/41.449/71.392/6.902 ms

############## annie - 12/30/21 00:22:52 EST -0500 ##############

2021-12-30 23:58:11 284 packets transmitted, 284 received, 0% packet loss, time 84919801ms
2021-12-30 23:58:11 rtt min/avg/max/mdev = 27.646/38.773/145.033/7.760 ms

############## annie - 12/31/21 00:22:53 EST -0500 ##############

2021-12-31 23:58:12 284 packets transmitted, 284 received, 0% packet loss, time 84918718ms
2021-12-31 23:58:12 rtt min/avg/max/mdev = 27.761/41.353/548.905/36.228 ms

############## annie - 01/01/22 00:22:55 EST -0500 ##############

2022-01-01 23:58:15 284 packets transmitted, 284 received, 0% packet loss, time 84920031ms
2022-01-01 23:58:15 rtt min/avg/max/mdev = 27.241/38.381/67.383/4.443 ms

############## annie - 01/02/22 00:22:54 EST -0500 ##############

2022-01-02 23:58:14 284 packets transmitted, 284 received, 0% packet loss, time 84920342ms
2022-01-02 23:58:14 rtt min/avg/max/mdev = 25.291/37.976/75.045/4.806 ms

############## annie - 01/04/22 00:22:55 EST -0500 ##############

2022-01-04 23:58:15 284 packets transmitted, 284 received, 0% packet loss, time 84920328ms
2022-01-04 23:58:15 rtt min/avg/max/mdev = 26.385/41.819/160.588/10.185 ms

############## annie - 01/05/22 00:22:57 EST -0500 ##############

2022-01-05 23:58:17 284 packets transmitted, 284 received, 0% packet loss, time 84919788ms
2022-01-05 23:58:17 rtt min/avg/max/mdev = 26.369/43.778/318.125/18.792 ms

############## annie - 01/06/22 00:22:59 EST -0500 ##############

2022-01-06 23:58:15 284 packets transmitted, 284 received, 0% packet loss, time 84915757ms
2022-01-06 23:58:15 rtt min/avg/max/mdev = 26.966/41.658/96.550/7.723 ms

############## annie - 01/07/22 00:23:01 EST -0500 ##############

2022-01-07 23:58:22 284 packets transmitted, 284 received, 0% packet loss, time 84920330ms
2022-01-07 23:58:22 rtt min/avg/max/mdev = 27.077/40.434/128.354/7.692 ms

############## annie - 01/08/22 00:23:00 EST -0500 ##############

2022-01-08 23:58:20 284 packets transmitted, 284 received, 0% packet loss, time 84920026ms
2022-01-08 23:58:20 rtt min/avg/max/mdev = 26.668/45.049/186.971/14.002 ms

############## annie - 01/09/22 00:23:04 EST -0500 ##############

2022-01-09 23:58:24 284 packets transmitted, 284 received, 0% packet loss, time 84919851ms
2022-01-09 23:58:24 rtt min/avg/max/mdev = 26.844/38.219/82.401/5.091 ms

############## annie - 01/10/22 00:23:07 EST -0500 ##############

2022-01-10 23:58:27 284 packets transmitted, 284 received, 0% packet loss, time 84920088ms
2022-01-10 23:58:27 rtt min/avg/max/mdev = 27.551/43.559/137.312/10.521 ms

############## annie - 01/11/22 00:23:09 EST -0500 ##############

2022-01-11 23:58:29 284 packets transmitted, 284 received, 0% packet loss, time 84919912ms
2022-01-11 23:58:29 rtt min/avg/max/mdev = 25.200/41.375/100.956/7.446 ms

############## annie - 01/12/22 00:23:04 EST -0500 ##############

2022-01-12 23:58:23 284 packets transmitted, 284 received, 0% packet loss, time 84919351ms
2022-01-12 23:58:23 rtt min/avg/max/mdev = 29.003/43.023/116.640/9.538 ms

############## annie - 01/13/22 00:23:06 EST -0500 ##############

2022-01-14 00:06:37 284 packets transmitted, 266 received, 6% packet loss, time 85111323ms
2022-01-14 00:06:37 rtt min/avg/max/mdev = 32.774/74.988/3745.150/228.804 ms

############## annie - 01/14/22 00:23:06 EST -0500 ##############

2022-01-14 23:58:25 284 packets transmitted, 284 received, 0% packet loss, time 84918423ms
2022-01-14 23:58:25 rtt min/avg/max/mdev = 26.322/38.669/75.527/5.528 ms

############## annie - 01/15/22 00:23:09 EST -0500 ##############

2022-01-15 23:58:29 284 packets transmitted, 284 received, 0% packet loss, time 84919938ms
2022-01-15 23:58:29 rtt min/avg/max/mdev = 25.766/38.654/62.041/4.556 ms

############## annie - 01/16/22 00:23:10 EST -0500 ##############

2022-01-16 23:58:29 284 packets transmitted, 284 received, 0% packet loss, time 84919594ms
2022-01-16 23:58:29 rtt min/avg/max/mdev = 26.484/38.043/54.808/3.923 ms

############## annie - 01/17/22 00:23:10 EST -0500 ##############

2022-01-17 23:58:30 284 packets transmitted, 284 received, 0% packet loss, time 84919145ms
2022-01-17 23:58:30 rtt min/avg/max/mdev = 27.390/38.457/57.405/4.040 ms

############## annie - 01/18/22 00:23:12 EST -0500 ##############

2022-01-18 23:58:31 284 packets transmitted, 284 received, 0% packet loss, time 84918963ms
2022-01-18 23:58:31 rtt min/avg/max/mdev = 27.228/41.273/71.924/7.008 ms

############## annie - 01/19/22 00:23:15 EST -0500 ##############

2022-01-19 23:58:35 284 packets transmitted, 284 received, 0% packet loss, time 84919997ms
2022-01-19 23:58:35 rtt min/avg/max/mdev = 26.333/42.953/203.813/12.510 ms

############## annie - 01/20/22 00:23:13 EST -0500 ##############

2022-01-20 23:58:34 284 packets transmitted, 284 received, 0% packet loss, time 84920937ms
2022-01-20 23:58:34 rtt min/avg/max/mdev = 27.824/43.095/69.495/7.258 ms

############## annie - 01/21/22 00:23:15 EST -0500 ##############

2022-01-21 23:58:35 284 packets transmitted, 284 received, 0% packet loss, time 84919540ms
2022-01-21 23:58:35 rtt min/avg/max/mdev = 27.194/41.022/118.094/9.260 ms

############## annie - 01/22/22 00:23:16 EST -0500 ##############

2022-01-22 23:58:36 284 packets transmitted, 284 received, 0% packet loss, time 84919755ms
2022-01-22 23:58:36 rtt min/avg/max/mdev = 26.349/39.535/300.134/16.363 ms

############## annie - 01/23/22 00:23:19 EST -0500 ##############

2022-01-23 23:58:39 284 packets transmitted, 284 received, 0% packet loss, time 84920182ms
2022-01-23 23:58:39 rtt min/avg/max/mdev = 28.289/38.823/59.014/4.301 ms

############## annie - 01/24/22 00:23:23 EST -0500 ##############

2022-01-24 23:58:43 284 packets transmitted, 284 received, 0% packet loss, time 84919932ms
2022-01-24 23:58:43 rtt min/avg/max/mdev = 27.192/44.761/136.198/11.444 ms

############## annie - 01/25/22 00:23:25 EST -0500 ##############

2022-01-25 23:58:46 284 packets transmitted, 284 received, 0% packet loss, time 84920990ms
2022-01-25 23:58:46 rtt min/avg/max/mdev = 28.859/43.519/156.933/13.610 ms

############## annie - 01/26/22 00:23:24 EST -0500 ##############

2022-01-26 23:58:44 284 packets transmitted, 284 received, 0% packet loss, time 84920375ms
2022-01-26 23:58:44 rtt min/avg/max/mdev = 30.790/41.118/148.861/9.940 ms

############## annie - 01/27/22 00:23:27 EST -0500 ##############

2022-01-27 23:58:46 284 packets transmitted, 284 received, 0% packet loss, time 84919460ms
2022-01-27 23:58:46 rtt min/avg/max/mdev = 27.617/43.372/283.052/16.805 ms

############## annie - 01/28/22 00:23:22 EST -0500 ##############

2022-01-28 23:58:42 284 packets transmitted, 284 received, 0% packet loss, time 84919528ms
2022-01-28 23:58:42 rtt min/avg/max/mdev = 27.746/43.405/141.483/10.698 ms

############## annie - 01/29/22 00:23:27 EST -0500 ##############

2022-01-29 23:58:47 284 packets transmitted, 284 received, 0% packet loss, time 84919838ms
2022-01-29 23:58:47 rtt min/avg/max/mdev = 27.438/39.209/116.909/6.873 ms

############## annie - 01/30/22 00:23:27 EST -0500 ##############

2022-01-30 23:58:46 284 packets transmitted, 284 received, 0% packet loss, time 84919197ms
2022-01-30 23:58:46 rtt min/avg/max/mdev = 26.986/40.851/252.200/15.699 ms

############## annie - 01/31/22 00:23:35 EST -0500 ##############

2022-01-31 23:58:54 284 packets transmitted, 284 received, 0% packet loss, time 84918947ms
2022-01-31 23:58:54 rtt min/avg/max/mdev = 28.233/44.306/153.780/13.211 ms

############## annie - 02/01/22 00:23:31 EST -0500 ##############

2022-02-01 23:58:50 284 packets transmitted, 284 received, 0% packet loss, time 84919615ms
2022-02-01 23:58:50 rtt min/avg/max/mdev = 28.702/41.623/139.665/9.412 ms

############## annie - 02/02/22 00:23:35 EST -0500 ##############

2022-02-02 23:58:54 284 packets transmitted, 284 received, 0% packet loss, time 84919576ms
2022-02-02 23:58:54 rtt min/avg/max/mdev = 28.836/42.506/98.871/8.748 ms

############## annie - 02/03/22 00:23:38 EST -0500 ##############

2022-02-03 23:58:57 284 packets transmitted, 284 received, 0% packet loss, time 84919476ms
2022-02-03 23:58:57 rtt min/avg/max/mdev = 27.803/42.517/76.692/7.122 ms

############## annie - 02/04/22 00:23:47 EST -0500 ##############

2022-02-04 23:59:06 284 packets transmitted, 284 received, 0% packet loss, time 84919057ms
2022-02-04 23:59:06 rtt min/avg/max/mdev = 27.414/42.640/202.041/11.868 ms

############## annie - 02/05/22 00:23:34 EST -0500 ##############

2022-02-05 23:58:53 284 packets transmitted, 284 received, 0% packet loss, time 84919114ms
2022-02-05 23:58:53 rtt min/avg/max/mdev = 27.645/38.915/55.559/4.596 ms

############## annie - 02/06/22 00:23:37 EST -0500 ##############

2022-02-06 23:58:57 284 packets transmitted, 284 received, 0% packet loss, time 84919539ms
2022-02-06 23:58:57 rtt min/avg/max/mdev = 29.672/38.727/58.444/4.333 ms

############## annie - 02/07/22 00:23:37 EST -0500 ##############

2022-02-07 23:58:57 284 packets transmitted, 284 received, 0% packet loss, time 84919824ms
2022-02-07 23:58:57 rtt min/avg/max/mdev = 29.965/41.716/74.288/6.975 ms

############## annie - 02/08/22 00:23:39 EST -0500 ##############

2022-02-08 23:58:59 284 packets transmitted, 284 received, 0% packet loss, time 84919360ms
2022-02-08 23:58:59 rtt min/avg/max/mdev = 27.878/41.245/70.532/6.781 ms

############## annie - 02/09/22 00:23:41 EST -0500 ##############

2022-02-09 23:59:01 284 packets transmitted, 284 received, 0% packet loss, time 84919820ms
2022-02-09 23:59:01 rtt min/avg/max/mdev = 25.385/41.083/71.120/6.993 ms

############## annie - 02/10/22 00:23:45 EST -0500 ##############

2022-02-11 00:04:03 284 packets transmitted, 283 received, 0% packet loss, time 84918065ms
2022-02-11 00:04:03 rtt min/avg/max/mdev = 27.515/42.439/214.156/13.382 ms

############## annie - 02/11/22 00:23:44 EST -0500 ##############

2022-02-11 23:59:03 284 packets transmitted, 284 received, 0% packet loss, time 84919572ms
2022-02-11 23:59:03 rtt min/avg/max/mdev = 26.326/41.798/110.308/8.186 ms

############## annie - 02/12/22 00:23:43 EST -0500 ##############

2022-02-12 23:59:03 284 packets transmitted, 284 received, 0% packet loss, time 84919820ms
2022-02-12 23:59:03 rtt min/avg/max/mdev = 28.280/38.876/56.883/4.522 ms

############## annie - 02/13/22 00:23:44 EST -0500 ##############

2022-02-13 23:59:03 284 packets transmitted, 284 received, 0% packet loss, time 84919286ms
2022-02-13 23:59:03 rtt min/avg/max/mdev = 26.998/38.820/130.228/7.327 ms

############## annie - 02/14/22 00:23:45 EST -0500 ##############

2022-02-14 23:59:05 284 packets transmitted, 284 received, 0% packet loss, time 84920215ms
2022-02-14 23:59:05 rtt min/avg/max/mdev = 27.268/40.901/62.397/6.627 ms

############## annie - 02/15/22 00:23:47 EST -0500 ##############

2022-02-16 00:04:06 284 packets transmitted, 283 received, 0% packet loss, time 84919343ms
2022-02-16 00:04:06 rtt min/avg/max/mdev = 27.229/42.480/100.966/7.754 ms

############## annie - 02/16/22 00:23:49 EST -0500 ##############

2022-02-16 23:59:09 284 packets transmitted, 284 received, 0% packet loss, time 84920363ms
2022-02-16 23:59:09 rtt min/avg/max/mdev = 27.359/40.230/62.981/6.238 ms

############## annie - 02/17/22 00:23:50 EST -0500 ##############

2022-02-17 23:59:09 284 packets transmitted, 284 received, 0% packet loss, time 84919523ms
2022-02-17 23:59:09 rtt min/avg/max/mdev = 27.446/41.914/79.676/7.261 ms

############## annie - 02/18/22 00:23:51 EST -0500 ##############

2022-02-18 23:59:10 284 packets transmitted, 284 received, 0% packet loss, time 84918923ms
2022-02-18 23:59:10 rtt min/avg/max/mdev = 27.078/41.491/74.600/7.231 ms

############## annie - 02/19/22 00:23:52 EST -0500 ##############

2022-02-19 23:59:12 284 packets transmitted, 284 received, 0% packet loss, time 84919256ms
2022-02-19 23:59:12 rtt min/avg/max/mdev = 28.775/39.064/68.621/5.021 ms

############## annie - 02/20/22 00:23:50 EST -0500 ##############

2022-02-20 23:59:10 284 packets transmitted, 284 received, 0% packet loss, time 84919440ms
2022-02-20 23:59:10 rtt min/avg/max/mdev = 29.962/39.661/85.864/6.028 ms

############## annie - 02/21/22 00:23:51 EST -0500 ##############

2022-02-21 23:59:10 284 packets transmitted, 284 received, 0% packet loss, time 84919358ms
2022-02-21 23:59:10 rtt min/avg/max/mdev = 27.630/40.600/80.213/7.069 ms

############## annie - 02/22/22 00:23:53 EST -0500 ##############

2022-02-22 23:59:13 284 packets transmitted, 284 received, 0% packet loss, time 84919388ms
2022-02-22 23:59:13 rtt min/avg/max/mdev = 27.024/42.294/145.164/9.432 ms

############## annie - 02/23/22 00:23:52 EST -0500 ##############

2022-02-23 23:59:13 284 packets transmitted, 284 received, 0% packet loss, time 84920049ms
2022-02-23 23:59:13 rtt min/avg/max/mdev = 27.308/47.816/539.457/48.014 ms

############## annie - 02/24/22 00:23:56 EST -0500 ##############

2022-02-24 23:59:15 284 packets transmitted, 284 received, 0% packet loss, time 84918708ms
2022-02-24 23:59:15 rtt min/avg/max/mdev = 26.237/42.471/157.259/10.562 ms

############## annie - 02/25/22 00:23:57 EST -0500 ##############

2022-02-25 23:59:16 284 packets transmitted, 284 received, 0% packet loss, time 84919401ms
2022-02-25 23:59:16 rtt min/avg/max/mdev = 26.751/41.584/71.243/7.516 ms

############## annie - 02/26/22 00:24:01 EST -0500 ##############

2022-02-26 23:59:21 284 packets transmitted, 284 received, 0% packet loss, time 84919940ms
2022-02-26 23:59:21 rtt min/avg/max/mdev = 28.964/38.699/61.152/4.206 ms

############## annie - 02/27/22 00:23:58 EST -0500 ##############

2022-02-27 23:59:18 284 packets transmitted, 284 received, 0% packet loss, time 84920232ms
2022-02-27 23:59:18 rtt min/avg/max/mdev = 26.850/38.455/170.362/8.985 ms

############## annie - 02/28/22 00:23:54 EST -0500 ##############

2022-02-28 23:59:14 284 packets transmitted, 284 received, 0% packet loss, time 84919395ms
2022-02-28 23:59:14 rtt min/avg/max/mdev = 27.781/42.473/122.611/8.997 ms

############## annie - 03/01/22 00:23:57 EST -0500 ##############

2022-03-01 23:59:17 284 packets transmitted, 284 received, 0% packet loss, time 84919539ms
2022-03-01 23:59:17 rtt min/avg/max/mdev = 31.643/50.108/82.439/8.048 ms

############## annie - 03/02/22 00:23:58 EST -0500 ##############

2022-03-02 23:59:17 284 packets transmitted, 284 received, 0% packet loss, time 84919034ms
2022-03-02 23:59:17 rtt min/avg/max/mdev = 28.182/44.237/448.157/25.176 ms

############## annie - 03/03/22 00:24:00 EST -0500 ##############

2022-03-03 23:59:20 284 packets transmitted, 284 received, 0% packet loss, time 84919623ms
2022-03-03 23:59:20 rtt min/avg/max/mdev = 28.132/41.238/76.521/6.821 ms

############## annie - 03/04/22 00:24:00 EST -0500 ##############

2022-03-04 23:59:19 284 packets transmitted, 284 received, 0% packet loss, time 84919518ms
2022-03-04 23:59:19 rtt min/avg/max/mdev = 27.805/42.837/167.635/12.705 ms

############## annie - 03/05/22 00:24:04 EST -0500 ##############

2022-03-05 23:59:22 284 packets transmitted, 284 received, 0% packet loss, time 84918511ms
2022-03-05 23:59:22 rtt min/avg/max/mdev = 29.882/38.789/113.962/6.243 ms

############## annie - 03/06/22 00:24:04 EST -0500 ##############

2022-03-06 23:59:23 284 packets transmitted, 284 received, 0% packet loss, time 84919238ms
2022-03-06 23:59:23 rtt min/avg/max/mdev = 27.050/39.023/201.798/10.498 ms

############## annie - 03/07/22 00:24:02 EST -0500 ##############

2022-03-07 23:59:22 284 packets transmitted, 284 received, 0% packet loss, time 84919474ms
2022-03-07 23:59:22 rtt min/avg/max/mdev = 26.850/43.075/116.793/9.208 ms

############## annie - 03/08/22 00:24:03 EST -0500 ##############

2022-03-08 23:59:22 284 packets transmitted, 284 received, 0% packet loss, time 84919583ms
2022-03-08 23:59:22 rtt min/avg/max/mdev = 28.713/42.901/363.177/20.499 ms

############## annie - 03/09/22 00:24:01 EST -0500 ##############

2022-03-09 23:59:20 284 packets transmitted, 284 received, 0% packet loss, time 84919078ms
2022-03-09 23:59:20 rtt min/avg/max/mdev = 28.099/41.921/153.176/11.032 ms

############## annie - 03/10/22 00:24:02 EST -0500 ##############

2022-03-10 23:59:22 284 packets transmitted, 284 received, 0% packet loss, time 84919609ms
2022-03-10 23:59:22 rtt min/avg/max/mdev = 25.294/42.360/136.808/10.461 ms

############## annie - 03/11/22 00:24:03 EST -0500 ##############

2022-03-11 23:59:23 284 packets transmitted, 284 received, 0% packet loss, time 84919743ms
2022-03-11 23:59:23 rtt min/avg/max/mdev = 29.723/42.416/67.735/7.001 ms

############## annie - 03/12/22 00:24:03 EST -0500 ##############

2022-03-12 23:59:24 284 packets transmitted, 284 received, 0% packet loss, time 84920537ms
2022-03-12 23:59:24 rtt min/avg/max/mdev = 27.160/39.897/81.478/5.948 ms

############## annie - 03/13/22 00:24:05 EST -0500 ##############

2022-03-13 23:59:25 284 packets transmitted, 284 received, 0% packet loss, time 84919870ms
2022-03-13 23:59:25 rtt min/avg/max/mdev = 28.836/40.485/64.596/5.583 ms

############## annie - 03/14/22 00:24:09 EST -0500 ##############

2022-03-15 00:04:28 284 packets transmitted, 282 received, 0% packet loss, time 84919836ms
2022-03-15 00:04:28 rtt min/avg/max/mdev = 28.207/43.771/157.779/10.381 ms

############## annie - 03/15/22 00:24:06 EST -0500 ##############

2022-03-15 23:59:24 284 packets transmitted, 284 received, 0% packet loss, time 84918165ms
2022-03-15 23:59:24 rtt min/avg/max/mdev = 26.324/43.691/490.334/27.412 ms

############## annie - 03/16/22 00:24:06 EST -0500 ##############

2022-03-16 23:59:25 284 packets transmitted, 284 received, 0% packet loss, time 84918842ms
2022-03-16 23:59:25 rtt min/avg/max/mdev = 29.183/42.543/249.792/15.629 ms

############## annie - 03/17/22 00:24:07 EST -0500 ##############

2022-03-17 23:59:26 284 packets transmitted, 284 received, 0% packet loss, time 84918889ms
2022-03-17 23:59:26 rtt min/avg/max/mdev = 27.332/42.844/297.200/16.623 ms

############## annie - 03/18/22 00:24:09 EST -0500 ##############

2022-03-18 23:59:28 284 packets transmitted, 284 received, 0% packet loss, time 84918872ms
2022-03-18 23:59:28 rtt min/avg/max/mdev = 26.339/42.320/369.535/20.857 ms

############## annie - 03/19/22 00:24:09 EST -0500 ##############

2022-03-19 23:59:27 284 packets transmitted, 284 received, 0% packet loss, time 84918725ms
2022-03-19 23:59:27 rtt min/avg/max/mdev = 26.553/38.572/62.106/4.820 ms

############## annie - 03/20/22 00:24:08 EST -0500 ##############

2022-03-20 23:59:28 284 packets transmitted, 284 received, 0% packet loss, time 84919441ms
2022-03-20 23:59:28 rtt min/avg/max/mdev = 28.086/37.711/55.683/4.549 ms

############## annie - 03/21/22 00:24:06 EST -0500 ##############

2022-03-21 23:59:26 284 packets transmitted, 284 received, 0% packet loss, time 84919370ms
2022-03-21 23:59:26 rtt min/avg/max/mdev = 28.041/52.044/1235.128/102.852 ms

############## annie - 03/22/22 00:24:10 EST -0500 ##############

2022-03-22 23:59:30 284 packets transmitted, 284 received, 0% packet loss, time 84920328ms
2022-03-22 23:59:30 rtt min/avg/max/mdev = 27.224/41.171/70.209/6.966 ms

############## annie - 03/23/22 00:24:12 EST -0500 ##############

2022-03-23 23:59:30 284 packets transmitted, 284 received, 0% packet loss, time 84918770ms
2022-03-23 23:59:30 rtt min/avg/max/mdev = 30.366/43.374/105.760/8.673 ms

############## annie - 03/24/22 00:24:13 EST -0500 ##############

2022-03-24 23:59:32 284 packets transmitted, 284 received, 0% packet loss, time 84919148ms
2022-03-24 23:59:32 rtt min/avg/max/mdev = 29.136/42.220/67.400/7.014 ms

############## annie - 03/25/22 00:24:14 EST -0500 ##############

2022-03-26 00:04:47 284 packets transmitted, 283 received, 0% packet loss, time 84933028ms
2022-03-26 00:04:47 rtt min/avg/max/mdev = 26.832/42.373/69.942/7.070 ms

############## annie - 03/26/22 00:24:12 EST -0500 ##############

2022-03-26 23:59:32 284 packets transmitted, 284 received, 0% packet loss, time 84919996ms
2022-03-26 23:59:32 rtt min/avg/max/mdev = 27.556/39.333/93.936/6.543 ms

############## annie - 03/27/22 00:24:18 EST -0500 ##############

2022-03-27 23:59:37 284 packets transmitted, 284 received, 0% packet loss, time 84919432ms
2022-03-27 23:59:37 rtt min/avg/max/mdev = 27.571/38.483/66.251/5.197 ms

############## annie - 03/28/22 00:24:11 EST -0500 ##############

2022-03-29 00:04:39 284 packets transmitted, 283 received, 0% packet loss, time 84927974ms
2022-03-29 00:04:39 rtt min/avg/max/mdev = 28.863/41.907/72.796/7.034 ms

############## annie - 03/29/22 00:24:12 EST -0500 ##############

2022-03-29 23:59:32 284 packets transmitted, 284 received, 0% packet loss, time 84919138ms
2022-03-29 23:59:32 rtt min/avg/max/mdev = 28.111/44.705/244.638/18.079 ms

############## annie - 03/30/22 00:24:13 EST -0500 ##############

2022-03-30 23:59:32 284 packets transmitted, 284 received, 0% packet loss, time 84919374ms
2022-03-30 23:59:32 rtt min/avg/max/mdev = 27.992/42.766/126.765/9.931 ms

############## annie - 03/31/22 00:24:16 EST -0500 ##############

2022-03-31 23:59:36 284 packets transmitted, 284 received, 0% packet loss, time 84919452ms
2022-03-31 23:59:36 rtt min/avg/max/mdev = 29.289/43.468/92.251/8.241 ms

############## annie - 04/01/22 00:24:17 EST -0500 ##############

2022-04-01 23:59:37 284 packets transmitted, 284 received, 0% packet loss, time 84920421ms
2022-04-01 23:59:37 rtt min/avg/max/mdev = 27.038/42.884/254.879/15.717 ms

############## annie - 04/02/22 00:24:17 EST -0500 ##############

2022-04-02 23:59:36 284 packets transmitted, 284 received, 0% packet loss, time 84919098ms
2022-04-02 23:59:36 rtt min/avg/max/mdev = 27.585/38.575/56.892/4.782 ms

############## annie - 04/03/22 00:24:19 EST -0500 ##############

2022-04-03 23:59:39 284 packets transmitted, 284 received, 0% packet loss, time 84919842ms
2022-04-03 23:59:39 rtt min/avg/max/mdev = 26.934/38.166/61.703/4.888 ms

############## annie - 04/04/22 00:24:23 EST -0500 ##############

2022-04-04 23:59:43 284 packets transmitted, 284 received, 0% packet loss, time 84919261ms
2022-04-04 23:59:43 rtt min/avg/max/mdev = 27.673/42.765/74.196/7.569 ms

############## annie - 04/06/22 00:24:17 EST -0500 ##############

2022-04-06 23:59:37 284 packets transmitted, 284 received, 0% packet loss, time 84919532ms
2022-04-06 23:59:37 rtt min/avg/max/mdev = 28.352/43.447/163.355/11.604 ms

############## annie - 04/07/22 00:24:16 EST -0500 ##############

2022-04-07 23:59:38 284 packets transmitted, 284 received, 0% packet loss, time 84921020ms
2022-04-07 23:59:38 rtt min/avg/max/mdev = 28.731/43.047/96.066/8.333 ms

############## annie - 04/08/22 00:24:19 EST -0500 ##############

2022-04-08 23:59:39 284 packets transmitted, 284 received, 0% packet loss, time 84919426ms
2022-04-08 23:59:39 rtt min/avg/max/mdev = 28.131/42.767/83.464/7.099 ms

############## annie - 04/09/22 00:24:29 EST -0500 ##############

2022-04-09 23:59:49 284 packets transmitted, 284 received, 0% packet loss, time 84919112ms
2022-04-09 23:59:49 rtt min/avg/max/mdev = 26.982/43.984/1522.605/88.019 ms

############## annie - 04/10/22 00:24:20 EST -0500 ##############

2022-04-10 23:59:39 284 packets transmitted, 284 received, 0% packet loss, time 84919480ms
2022-04-10 23:59:40 rtt min/avg/max/mdev = 28.118/39.547/155.125/8.281 ms

############## annie - 04/11/22 00:24:20 EST -0500 ##############

2022-04-11 23:59:39 284 packets transmitted, 284 received, 0% packet loss, time 84918912ms
2022-04-11 23:59:39 rtt min/avg/max/mdev = 26.467/43.304/111.193/9.644 ms

############## annie - 04/12/22 00:24:24 EST -0500 ##############

2022-04-12 23:59:44 284 packets transmitted, 284 received, 0% packet loss, time 84920067ms
2022-04-12 23:59:44 rtt min/avg/max/mdev = 27.069/44.076/186.742/13.607 ms

############## annie - 04/13/22 00:24:26 EST -0500 ##############

2022-04-13 23:59:46 284 packets transmitted, 284 received, 0% packet loss, time 84919536ms
2022-04-13 23:59:46 rtt min/avg/max/mdev = 28.511/40.029/87.188/7.431 ms

############## annie - 04/14/22 00:24:21 EST -0500 ##############

2022-04-14 23:59:41 284 packets transmitted, 284 received, 0% packet loss, time 84919527ms
2022-04-14 23:59:41 rtt min/avg/max/mdev = 27.395/40.219/80.536/6.479 ms

############## annie - 04/15/22 00:24:24 EST -0500 ##############

2022-04-15 23:59:43 284 packets transmitted, 284 received, 0% packet loss, time 84918995ms
2022-04-15 23:59:43 rtt min/avg/max/mdev = 28.706/43.146/150.253/9.957 ms

############## annie - 04/16/22 00:24:22 EST -0500 ##############

2022-04-16 23:59:40 284 packets transmitted, 284 received, 0% packet loss, time 84917719ms
2022-04-16 23:59:40 rtt min/avg/max/mdev = 27.120/39.372/149.819/8.671 ms

############## annie - 04/17/22 00:24:23 EST -0500 ##############

2022-04-17 23:59:42 284 packets transmitted, 284 received, 0% packet loss, time 84919085ms
2022-04-17 23:59:42 rtt min/avg/max/mdev = 29.236/39.025/68.802/5.073 ms

############## annie - 04/18/22 00:24:21 EST -0500 ##############

2022-04-18 23:59:42 284 packets transmitted, 284 received, 0% packet loss, time 84920245ms
2022-04-18 23:59:42 rtt min/avg/max/mdev = 28.130/42.837/152.552/9.581 ms

############## annie - 04/19/22 00:24:24 EST -0500 ##############

2022-04-20 00:04:58 284 packets transmitted, 283 received, 0% packet loss, time 84934158ms
2022-04-20 00:04:58 rtt min/avg/max/mdev = 26.284/44.172/690.478/39.976 ms

############## annie - 04/20/22 00:24:28 EST -0500 ##############

2022-04-21 00:04:59 284 packets transmitted, 283 received, 0% packet loss, time 84931221ms
2022-04-21 00:04:59 rtt min/avg/max/mdev = 27.140/42.311/87.721/7.652 ms

############## annie - 04/21/22 00:24:28 EST -0500 ##############

2022-04-21 23:59:49 284 packets transmitted, 284 received, 0% packet loss, time 84920557ms
2022-04-21 23:59:49 rtt min/avg/max/mdev = 26.912/42.571/77.544/7.720 ms

############## annie - 04/22/22 00:24:28 EST -0500 ##############

2022-04-22 23:59:47 284 packets transmitted, 284 received, 0% packet loss, time 84918478ms
2022-04-22 23:59:47 rtt min/avg/max/mdev = 27.080/41.201/74.275/6.920 ms

############## annie - 04/23/22 00:24:27 EST -0500 ##############

2022-04-23 23:59:46 284 packets transmitted, 284 received, 0% packet loss, time 84919333ms
2022-04-23 23:59:46 rtt min/avg/max/mdev = 28.318/38.865/58.338/4.664 ms

############## annie - 04/24/22 00:24:27 EST -0500 ##############

2022-04-24 23:59:47 284 packets transmitted, 284 received, 0% packet loss, time 84919998ms
2022-04-24 23:59:47 rtt min/avg/max/mdev = 27.234/38.962/157.978/10.850 ms

############## annie - 04/25/22 00:24:26 EST -0500 ##############

2022-04-25 23:59:46 284 packets transmitted, 284 received, 0% packet loss, time 84919925ms
2022-04-25 23:59:46 rtt min/avg/max/mdev = 29.014/42.798/79.195/8.594 ms

############## annie - 04/26/22 00:24:27 EST -0500 ##############

2022-04-26 23:59:47 284 packets transmitted, 284 received, 0% packet loss, time 84919575ms
2022-04-26 23:59:47 rtt min/avg/max/mdev = 26.438/42.025/76.500/7.529 ms

############## annie - 04/27/22 00:24:28 EST -0500 ##############

2022-04-27 23:59:48 284 packets transmitted, 284 received, 0% packet loss, time 84919321ms
2022-04-27 23:59:48 rtt min/avg/max/mdev = 27.184/44.094/157.828/14.126 ms

############## annie - 04/28/22 00:24:32 EST -0500 ##############

2022-04-28 23:59:51 284 packets transmitted, 284 received, 0% packet loss, time 84918523ms
2022-04-28 23:59:51 rtt min/avg/max/mdev = 28.142/42.523/100.094/8.106 ms

############## annie - 04/29/22 00:24:32 EST -0500 ##############

2022-04-29 23:59:51 284 packets transmitted, 284 received, 0% packet loss, time 84919808ms
2022-04-29 23:59:51 rtt min/avg/max/mdev = 27.717/42.599/186.964/13.370 ms

############## annie - 04/30/22 00:24:30 EST -0500 ##############

2022-04-30 23:59:49 284 packets transmitted, 284 received, 0% packet loss, time 84919208ms
2022-04-30 23:59:49 rtt min/avg/max/mdev = 29.750/38.650/51.273/3.897 ms

############## annie - 05/01/22 00:24:29 EST -0500 ##############

2022-05-01 23:59:49 284 packets transmitted, 284 received, 0% packet loss, time 84919727ms
2022-05-01 23:59:49 rtt min/avg/max/mdev = 27.224/39.197/142.199/10.485 ms

############## annie - 05/02/22 00:24:28 EST -0500 ##############

2022-05-02 23:59:46 284 packets transmitted, 284 received, 0% packet loss, time 84918459ms
2022-05-02 23:59:46 rtt min/avg/max/mdev = 26.837/42.931/159.297/14.192 ms

############## annie - 05/03/22 00:24:30 EST -0500 ##############

2022-05-03 23:59:50 284 packets transmitted, 284 received, 0% packet loss, time 84919461ms
2022-05-03 23:59:50 rtt min/avg/max/mdev = 27.505/43.865/148.958/11.929 ms

############## annie - 05/04/22 00:24:31 EST -0500 ##############

2022-05-04 23:59:50 284 packets transmitted, 284 received, 0% packet loss, time 84919109ms
2022-05-04 23:59:50 rtt min/avg/max/mdev = 27.108/41.321/119.136/8.146 ms

############## annie - 05/05/22 00:24:33 EST -0500 ##############

2022-05-05 23:59:52 284 packets transmitted, 284 received, 0% packet loss, time 84918964ms
2022-05-05 23:59:52 rtt min/avg/max/mdev = 27.961/45.018/189.050/16.494 ms

############## annie - 05/06/22 00:24:34 EST -0500 ##############

2022-05-06 23:59:52 284 packets transmitted, 284 received, 0% packet loss, time 84918010ms
2022-05-06 23:59:52 rtt min/avg/max/mdev = 28.244/43.318/87.330/8.508 ms

############## annie - 05/07/22 00:24:33 EST -0500 ##############

2022-05-07 23:59:52 284 packets transmitted, 284 received, 0% packet loss, time 84919219ms
2022-05-07 23:59:52 rtt min/avg/max/mdev = 27.181/38.925/55.429/4.872 ms

############## annie - 05/08/22 00:24:30 EST -0500 ##############

2022-05-08 23:59:49 284 packets transmitted, 284 received, 0% packet loss, time 84919305ms
2022-05-08 23:59:49 rtt min/avg/max/mdev = 27.273/39.331/159.583/8.787 ms

############## annie - 05/09/22 00:24:30 EST -0500 ##############

2022-05-09 23:59:50 284 packets transmitted, 284 received, 0% packet loss, time 84919595ms
2022-05-09 23:59:50 rtt min/avg/max/mdev = 27.766/43.039/244.286/15.590 ms

############## annie - 05/10/22 00:24:32 EST -0500 ##############

2022-05-10 23:59:51 284 packets transmitted, 284 received, 0% packet loss, time 84918658ms
2022-05-10 23:59:51 rtt min/avg/max/mdev = 27.006/43.618/325.188/21.523 ms

############## annie - 05/11/22 00:24:33 EST -0500 ##############

2022-05-11 23:59:54 284 packets transmitted, 284 received, 0% packet loss, time 84920743ms
2022-05-11 23:59:54 rtt min/avg/max/mdev = 28.849/44.225/211.281/17.543 ms

############## annie - 05/12/22 00:24:34 EST -0500 ##############

2022-05-12 23:59:53 284 packets transmitted, 284 received, 0% packet loss, time 84919446ms
2022-05-12 23:59:53 rtt min/avg/max/mdev = 27.433/42.434/131.812/9.747 ms

############## annie - 05/13/22 00:24:35 EST -0500 ##############

2022-05-13 23:59:54 284 packets transmitted, 284 received, 0% packet loss, time 84919063ms
2022-05-13 23:59:54 rtt min/avg/max/mdev = 28.217/43.397/197.741/13.679 ms

############## annie - 05/14/22 00:24:36 EST -0500 ##############

2022-05-14 23:59:54 284 packets transmitted, 284 received, 0% packet loss, time 84917476ms
2022-05-14 23:59:54 rtt min/avg/max/mdev = 27.529/39.387/197.104/10.583 ms

############## annie - 05/15/22 00:24:34 EST -0500 ##############

2022-05-15 23:59:52 284 packets transmitted, 284 received, 0% packet loss, time 84917796ms
2022-05-15 23:59:52 rtt min/avg/max/mdev = 27.959/38.222/50.963/4.095 ms

############## annie - 05/16/22 00:24:34 EST -0500 ##############

2022-05-17 00:04:53 284 packets transmitted, 283 received, 0% packet loss, time 84918666ms
2022-05-17 00:04:53 rtt min/avg/max/mdev = 28.784/40.905/116.384/8.051 ms

############## annie - 05/17/22 00:24:34 EST -0500 ##############

2022-05-17 23:59:54 284 packets transmitted, 284 received, 0% packet loss, time 84920100ms
2022-05-17 23:59:54 rtt min/avg/max/mdev = 28.961/75.336/1359.956/179.168 ms

############## annie - 05/18/22 00:24:37 EST -0500 ##############

2022-05-18 23:59:56 284 packets transmitted, 284 received, 0% packet loss, time 84919434ms
2022-05-18 23:59:56 rtt min/avg/max/mdev = 28.455/42.549/76.998/7.367 ms

############## annie - 05/19/22 00:24:35 EST -0500 ##############

2022-05-19 23:59:55 284 packets transmitted, 284 received, 0% packet loss, time 84920083ms
2022-05-19 23:59:55 rtt min/avg/max/mdev = 27.918/41.633/206.698/11.897 ms

############## annie - 05/20/22 00:24:36 EST -0500 ##############

2022-05-20 23:59:55 284 packets transmitted, 284 received, 0% packet loss, time 84918803ms
2022-05-20 23:59:55 rtt min/avg/max/mdev = 26.216/41.244/88.644/7.603 ms

############## annie - 05/21/22 00:24:45 EST -0500 ##############

2022-05-22 00:00:05 284 packets transmitted, 284 received, 0% packet loss, time 84919875ms
2022-05-22 00:00:05 rtt min/avg/max/mdev = 27.310/39.393/128.953/7.283 ms

############## annie - 05/22/22 00:24:38 EST -0500 ##############

2022-05-22 23:59:57 284 packets transmitted, 284 received, 0% packet loss, time 84919191ms
2022-05-22 23:59:57 rtt min/avg/max/mdev = 27.149/40.121/69.289/5.919 ms

############## annie - 05/23/22 00:24:38 EST -0500 ##############

2022-05-23 23:59:57 284 packets transmitted, 284 received, 0% packet loss, time 84919080ms
2022-05-23 23:59:57 rtt min/avg/max/mdev = 27.244/45.430/162.063/16.255 ms

############## annie - 05/24/22 00:24:37 EST -0500 ##############

2022-05-24 23:59:56 284 packets transmitted, 284 received, 0% packet loss, time 84919275ms
2022-05-24 23:59:56 rtt min/avg/max/mdev = 26.198/45.143/353.983/20.596 ms

############## annie - 05/25/22 00:24:37 EST -0500 ##############

2022-05-25 23:59:57 284 packets transmitted, 284 received, 0% packet loss, time 84919154ms
2022-05-25 23:59:57 rtt min/avg/max/mdev = 26.962/42.107/184.283/10.999 ms

############## annie - 05/26/22 00:24:38 EST -0500 ##############

2022-05-26 23:59:56 284 packets transmitted, 284 received, 0% packet loss, time 84918876ms
2022-05-26 23:59:56 rtt min/avg/max/mdev = 26.823/40.928/82.634/7.195 ms

############## annie - 05/27/22 00:24:37 EST -0500 ##############

2022-05-27 23:59:57 284 packets transmitted, 284 received, 0% packet loss, time 84919225ms
2022-05-27 23:59:57 rtt min/avg/max/mdev = 28.075/44.191/679.740/38.365 ms

############## annie - 05/28/22 00:24:42 EST -0500 ##############

2022-05-29 00:00:02 284 packets transmitted, 284 received, 0% packet loss, time 84920126ms
2022-05-29 00:00:02 rtt min/avg/max/mdev = 26.787/41.644/98.994/7.648 ms

############## annie - 05/29/22 00:24:42 EST -0500 ##############

2022-05-30 00:00:03 284 packets transmitted, 284 received, 0% packet loss, time 84920409ms
2022-05-30 00:00:03 rtt min/avg/max/mdev = 29.559/38.946/57.298/4.491 ms

############## annie - 05/31/22 00:24:40 EST -0500 ##############

2022-06-01 00:05:11 284 packets transmitted, 283 received, 0% packet loss, time 84930527ms
2022-06-01 00:05:11 rtt min/avg/max/mdev = 29.811/43.513/88.159/8.169 ms

############## annie - 06/01/22 00:24:41 EST -0500 ##############

2022-06-02 00:00:01 284 packets transmitted, 284 received, 0% packet loss, time 84920377ms
2022-06-02 00:00:01 rtt min/avg/max/mdev = 27.296/44.166/157.786/13.861 ms

############## annie - 06/02/22 00:24:40 EST -0500 ##############

2022-06-02 23:59:59 284 packets transmitted, 284 received, 0% packet loss, time 84918616ms
2022-06-02 23:59:59 rtt min/avg/max/mdev = 30.169/41.959/72.236/6.942 ms

############## annie - 06/03/22 00:24:42 EST -0500 ##############

2022-06-04 00:00:03 284 packets transmitted, 284 received, 0% packet loss, time 84920817ms
2022-06-04 00:00:03 rtt min/avg/max/mdev = 26.884/40.137/70.872/6.311 ms

############## annie - 06/04/22 00:24:45 EST -0500 ##############

2022-06-05 00:00:05 284 packets transmitted, 284 received, 0% packet loss, time 84920077ms
2022-06-05 00:00:05 rtt min/avg/max/mdev = 26.678/39.725/60.268/5.314 ms

############## annie - 06/05/22 00:24:42 EST -0500 ##############

2022-06-06 00:00:02 284 packets transmitted, 284 received, 0% packet loss, time 84919856ms
2022-06-06 00:00:02 rtt min/avg/max/mdev = 28.159/39.475/122.895/7.419 ms

############## annie - 06/06/22 00:24:42 EST -0500 ##############

2022-06-07 00:00:02 284 packets transmitted, 284 received, 0% packet loss, time 84919865ms
2022-06-07 00:00:02 rtt min/avg/max/mdev = 27.508/43.309/129.510/8.929 ms

############## annie - 06/07/22 00:24:47 EST -0500 ##############

2022-06-08 00:00:06 284 packets transmitted, 284 received, 0% packet loss, time 84919077ms
2022-06-08 00:00:07 rtt min/avg/max/mdev = 27.599/52.677/1239.282/72.451 ms

############## annie - 06/08/22 00:24:41 EST -0500 ##############

2022-06-09 00:00:01 284 packets transmitted, 284 received, 0% packet loss, time 84919514ms
2022-06-09 00:00:01 rtt min/avg/max/mdev = 27.034/44.413/84.607/9.547 ms

############## annie - 06/09/22 00:24:42 EST -0500 ##############

2022-06-10 00:00:03 284 packets transmitted, 284 received, 0% packet loss, time 84920950ms
2022-06-10 00:00:03 rtt min/avg/max/mdev = 27.578/41.770/65.056/6.576 ms

############## annie - 06/11/22 00:24:42 EST -0500 ##############

2022-06-12 00:00:01 284 packets transmitted, 284 received, 0% packet loss, time 84919451ms
2022-06-12 00:00:01 rtt min/avg/max/mdev = 26.506/42.033/268.616/17.556 ms

############## annie - 06/12/22 00:24:44 EST -0500 ##############

2022-06-13 00:00:04 284 packets transmitted, 284 received, 0% packet loss, time 84920369ms
2022-06-13 00:00:04 rtt min/avg/max/mdev = 25.550/39.884/142.736/8.289 ms

############## annie - 06/13/22 00:24:43 EST -0500 ##############

2022-06-14 00:00:03 284 packets transmitted, 284 received, 0% packet loss, time 84919347ms
2022-06-14 00:00:03 rtt min/avg/max/mdev = 27.178/48.580/569.303/36.855 ms

############## annie - 06/14/22 00:24:50 EST -0500 ##############

2022-06-15 00:00:09 284 packets transmitted, 284 received, 0% packet loss, time 84919508ms
2022-06-15 00:00:09 rtt min/avg/max/mdev = 29.327/44.781/170.253/13.296 ms

############## annie - 06/15/22 00:24:47 EST -0500 ##############

2022-06-16 00:05:07 284 packets transmitted, 283 received, 0% packet loss, time 84920183ms
2022-06-16 00:05:07 rtt min/avg/max/mdev = 27.147/44.111/241.759/18.227 ms

############## annie - 06/16/22 00:24:50 EST -0500 ##############

2022-06-17 00:00:10 284 packets transmitted, 284 received, 0% packet loss, time 84919325ms
2022-06-17 00:00:10 rtt min/avg/max/mdev = 29.706/47.788/1141.466/67.057 ms

############## annie - 06/18/22 00:24:44 EST -0500 ##############

2022-06-19 00:00:04 284 packets transmitted, 284 received, 0% packet loss, time 84920235ms
2022-06-19 00:00:04 rtt min/avg/max/mdev = 27.402/38.728/77.458/5.155 ms

############## annie - 06/19/22 00:24:46 EST -0500 ##############

2022-06-20 00:00:06 284 packets transmitted, 284 received, 0% packet loss, time 84919643ms
2022-06-20 00:00:06 rtt min/avg/max/mdev = 27.030/41.192/155.462/11.153 ms

############## annie - 06/20/22 00:24:47 EST -0500 ##############

2022-06-21 00:00:06 284 packets transmitted, 284 received, 0% packet loss, time 84919674ms
2022-06-21 00:00:06 rtt min/avg/max/mdev = 27.259/42.872/72.808/8.127 ms

############## annie - 06/22/22 00:24:47 EST -0500 ##############

2022-06-23 00:00:06 284 packets transmitted, 284 received, 0% packet loss, time 84919446ms
2022-06-23 00:00:06 rtt min/avg/max/mdev = 27.248/49.278/1358.270/80.438 ms

############## annie - 06/25/22 00:24:50 EST -0500 ##############

2022-06-26 00:00:10 284 packets transmitted, 284 received, 0% packet loss, time 84919644ms
2022-06-26 00:00:10 rtt min/avg/max/mdev = 27.153/38.712/77.229/4.785 ms

############## annie - 06/26/22 00:24:51 EST -0500 ##############

2022-06-27 00:00:10 284 packets transmitted, 284 received, 0% packet loss, time 84919342ms
2022-06-27 00:00:10 rtt min/avg/max/mdev = 29.089/41.880/74.679/6.917 ms

############## annie - 06/28/22 00:24:52 EST -0500 ##############

2022-06-29 00:00:12 284 packets transmitted, 284 received, 0% packet loss, time 84919822ms
2022-06-29 00:00:12 rtt min/avg/max/mdev = 29.801/49.272/701.646/52.032 ms

############## annie - 06/29/22 00:24:50 EST -0500 ##############

2022-06-30 00:00:10 284 packets transmitted, 284 received, 0% packet loss, time 84919941ms
2022-06-30 00:00:10 rtt min/avg/max/mdev = 26.784/46.313/608.609/36.944 ms

############## annie - 06/30/22 00:24:54 EST -0500 ##############

2022-07-01 00:05:18 284 packets transmitted, 282 received, 0% packet loss, time 84923326ms
2022-07-01 00:05:18 rtt min/avg/max/mdev = 30.705/45.342/144.430/12.055 ms

############## annie - 07/01/22 00:24:52 EST -0500 ##############

2022-07-02 00:00:13 284 packets transmitted, 284 received, 0% packet loss, time 84920973ms
2022-07-02 00:00:13 rtt min/avg/max/mdev = 26.253/42.679/149.537/12.292 ms

############## annie - 07/02/22 00:24:55 EST -0500 ##############

2022-07-03 00:05:18 284 packets transmitted, 283 received, 0% packet loss, time 84923304ms
2022-07-03 00:05:18 rtt min/avg/max/mdev = 28.271/39.479/147.982/8.031 ms

############## annie - 07/03/22 00:24:55 EST -0500 ##############

2022-07-04 00:05:50 284 packets transmitted, 281 received, 1% packet loss, time 84955462ms
2022-07-04 00:05:50 rtt min/avg/max/mdev = 26.577/44.514/154.493/24.877 ms

############## annie - 07/04/22 00:24:57 EST -0500 ##############

2022-07-05 00:05:17 284 packets transmitted, 283 received, 0% packet loss, time 84919717ms
2022-07-05 00:05:17 rtt min/avg/max/mdev = 26.909/42.760/186.069/21.811 ms

############## annie - 07/05/22 00:24:53 EST -0500 ##############

2022-07-06 00:05:23 284 packets transmitted, 283 received, 0% packet loss, time 84930526ms
2022-07-06 00:05:23 rtt min/avg/max/mdev = 26.892/42.932/163.456/11.654 ms

############## annie - 07/06/22 00:24:54 EST -0500 ##############

2022-07-07 00:05:23 284 packets transmitted, 283 received, 0% packet loss, time 84929550ms
2022-07-07 00:05:23 rtt min/avg/max/mdev = 28.342/46.104/505.257/30.410 ms

############## annie - 07/07/22 00:24:57 EST -0500 ##############

2022-07-08 00:00:16 284 packets transmitted, 284 received, 0% packet loss, time 84919509ms
2022-07-08 00:00:16 rtt min/avg/max/mdev = 27.775/45.543/477.406/29.683 ms

############## annie - 07/08/22 00:25:02 EST -0500 ##############

2022-07-09 00:00:21 284 packets transmitted, 284 received, 0% packet loss, time 84919600ms
2022-07-09 00:00:21 rtt min/avg/max/mdev = 27.040/42.091/113.341/8.111 ms

############## annie - 07/09/22 00:24:58 EST -0500 ##############

2022-07-10 00:05:19 284 packets transmitted, 283 received, 0% packet loss, time 84920922ms
2022-07-10 00:05:19 rtt min/avg/max/mdev = 26.763/42.272/156.117/18.594 ms

############## annie - 07/10/22 00:24:59 EST -0500 ##############

2022-07-11 00:05:34 284 packets transmitted, 283 received, 0% packet loss, time 84934504ms
2022-07-11 00:05:34 rtt min/avg/max/mdev = 28.241/39.402/149.456/11.550 ms

############## annie - 07/11/22 00:25:02 EST -0500 ##############

2022-07-12 00:00:24 284 packets transmitted, 284 received, 0% packet loss, time 84921921ms
2022-07-12 00:00:24 rtt min/avg/max/mdev = 27.708/51.867/1940.558/114.933 ms

############## annie - 07/12/22 00:24:58 EST -0500 ##############

2022-07-13 00:00:18 284 packets transmitted, 284 received, 0% packet loss, time 84919799ms
2022-07-13 00:00:18 rtt min/avg/max/mdev = 28.724/43.760/285.949/16.760 ms

############## annie - 07/13/22 00:24:58 EST -0500 ##############

2022-07-14 00:00:18 284 packets transmitted, 284 received, 0% packet loss, time 84919587ms
2022-07-14 00:00:18 rtt min/avg/max/mdev = 26.796/43.475/201.022/13.655 ms

############## annie - 07/14/22 00:24:59 EST -0500 ##############

2022-07-15 00:00:18 284 packets transmitted, 284 received, 0% packet loss, time 84919143ms
2022-07-15 00:00:18 rtt min/avg/max/mdev = 27.229/43.231/153.784/13.003 ms

############## annie - 07/15/22 00:25:00 EST -0500 ##############

2022-07-16 00:00:20 284 packets transmitted, 284 received, 0% packet loss, time 84919696ms
2022-07-16 00:00:20 rtt min/avg/max/mdev = 27.313/41.636/144.779/11.135 ms

############## annie - 07/16/22 00:25:03 EST -0500 ##############

2022-07-17 00:00:21 284 packets transmitted, 284 received, 0% packet loss, time 84918363ms
2022-07-17 00:00:21 rtt min/avg/max/mdev = 28.107/39.520/107.567/6.306 ms

############## annie - 07/17/22 00:25:04 EST -0500 ##############

2022-07-18 00:00:24 284 packets transmitted, 284 received, 0% packet loss, time 84920043ms
2022-07-18 00:00:24 rtt min/avg/max/mdev = 26.592/38.586/64.264/5.334 ms

############## annie - 07/18/22 00:25:01 EST -0500 ##############

2022-07-19 00:00:20 284 packets transmitted, 284 received, 0% packet loss, time 84918999ms
2022-07-19 00:00:20 rtt min/avg/max/mdev = 27.865/42.745/120.945/7.933 ms

############## annie - 07/19/22 00:24:59 EST -0500 ##############

2022-07-20 00:05:28 284 packets transmitted, 282 received, 0% packet loss, time 84929269ms
2022-07-20 00:05:28 rtt min/avg/max/mdev = 27.618/46.143/235.705/21.848 ms

############## annie - 07/20/22 00:25:06 EST -0500 ##############

2022-07-21 00:00:25 284 packets transmitted, 284 received, 0% packet loss, time 84918983ms
2022-07-21 00:00:25 rtt min/avg/max/mdev = 26.101/42.151/71.213/7.429 ms

############## annie - 07/21/22 00:25:02 EST -0500 ##############

2022-07-22 00:05:33 284 packets transmitted, 283 received, 0% packet loss, time 84931310ms
2022-07-22 00:05:33 rtt min/avg/max/mdev = 26.770/47.182/169.594/23.666 ms

############## annie - 07/22/22 00:25:04 EST -0500 ##############

2022-07-23 00:00:23 284 packets transmitted, 284 received, 0% packet loss, time 84919246ms
2022-07-23 00:00:23 rtt min/avg/max/mdev = 25.556/41.448/74.948/7.489 ms

############## annie - 07/23/22 00:25:03 EST -0500 ##############

2022-07-24 00:00:21 284 packets transmitted, 284 received, 0% packet loss, time 84918317ms
2022-07-24 00:00:21 rtt min/avg/max/mdev = 28.042/38.601/51.126/3.856 ms

############## annie - 07/24/22 00:25:07 EST -0500 ##############

2022-07-25 00:00:27 284 packets transmitted, 284 received, 0% packet loss, time 84919359ms
2022-07-25 00:00:27 rtt min/avg/max/mdev = 27.836/38.042/57.187/4.246 ms

############## annie - 07/25/22 00:25:05 EST -0500 ##############

2022-07-26 00:05:37 284 packets transmitted, 283 received, 0% packet loss, time 84931599ms
2022-07-26 00:05:37 rtt min/avg/max/mdev = 26.430/41.335/75.854/6.735 ms

############## annie - 07/26/22 00:25:03 EST -0500 ##############

2022-07-27 00:05:27 284 packets transmitted, 283 received, 0% packet loss, time 84923901ms
2022-07-27 00:05:27 rtt min/avg/max/mdev = 29.151/45.312/159.479/20.213 ms

############## annie - 07/27/22 00:25:07 EST -0500 ##############

2022-07-28 00:05:26 284 packets transmitted, 283 received, 0% packet loss, time 84919137ms
2022-07-28 00:05:26 rtt min/avg/max/mdev = 27.695/48.188/865.414/62.740 ms

############## annie - 07/28/22 00:25:08 EST -0500 ##############

2022-07-29 00:00:26 284 packets transmitted, 284 received, 0% packet loss, time 84918451ms
2022-07-29 00:00:26 rtt min/avg/max/mdev = 29.111/43.412/195.868/11.555 ms

############## annie - 07/29/22 00:25:06 EST -0500 ##############

2022-07-30 00:00:26 284 packets transmitted, 284 received, 0% packet loss, time 84919551ms
2022-07-30 00:00:26 rtt min/avg/max/mdev = 27.864/40.620/67.755/6.721 ms

############## annie - 07/30/22 00:25:10 EST -0500 ##############

2022-07-31 00:00:29 284 packets transmitted, 284 received, 0% packet loss, time 84918893ms
2022-07-31 00:00:29 rtt min/avg/max/mdev = 25.450/38.802/71.380/5.496 ms

############## annie - 07/31/22 00:25:11 EST -0500 ##############

2022-08-01 00:00:30 284 packets transmitted, 284 received, 0% packet loss, time 84918773ms
2022-08-01 00:00:30 rtt min/avg/max/mdev = 27.295/38.574/60.262/4.805 ms

############## annie - 08/01/22 00:25:08 EST -0500 ##############

2022-08-02 00:00:26 284 packets transmitted, 284 received, 0% packet loss, time 84917863ms
2022-08-02 00:00:26 rtt min/avg/max/mdev = 28.536/42.755/75.885/7.527 ms

############## annie - 08/02/22 00:25:08 EST -0500 ##############

2022-08-03 00:00:28 284 packets transmitted, 284 received, 0% packet loss, time 84919710ms
2022-08-03 00:00:28 rtt min/avg/max/mdev = 27.895/43.114/100.377/8.554 ms

############## annie - 08/03/22 00:25:08 EST -0500 ##############

2022-08-04 00:05:53 284 packets transmitted, 281 received, 1% packet loss, time 84944819ms
2022-08-04 00:05:53 rtt min/avg/max/mdev = 26.220/43.827/158.765/14.946 ms

############## annie - 08/04/22 00:25:10 EST -0500 ##############

2022-08-05 00:05:40 284 packets transmitted, 283 received, 0% packet loss, time 84929257ms
2022-08-05 00:05:40 rtt min/avg/max/mdev = 30.879/43.574/160.232/10.160 ms

############## annie - 08/05/22 00:25:09 EST -0500 ##############

2022-08-06 00:00:28 284 packets transmitted, 284 received, 0% packet loss, time 84918958ms
2022-08-06 00:00:28 rtt min/avg/max/mdev = 27.711/40.884/94.795/6.913 ms

############## annie - 08/06/22 00:25:10 EST -0500 ##############

2022-08-07 00:00:28 284 packets transmitted, 284 received, 0% packet loss, time 84917671ms
2022-08-07 00:00:28 rtt min/avg/max/mdev = 26.564/39.529/143.568/8.210 ms

############## annie - 08/07/22 00:25:13 EST -0500 ##############

2022-08-08 00:05:39 284 packets transmitted, 283 received, 0% packet loss, time 84926477ms
2022-08-08 00:05:39 rtt min/avg/max/mdev = 27.978/40.353/147.553/11.721 ms

############## annie - 08/08/22 00:25:13 EST -0500 ##############

2022-08-09 00:05:37 284 packets transmitted, 283 received, 0% packet loss, time 84923991ms
2022-08-09 00:05:37 rtt min/avg/max/mdev = 28.818/47.866/257.015/25.442 ms

############## annie - 08/09/22 00:25:11 EST -0500 ##############

2022-08-10 00:00:29 284 packets transmitted, 284 received, 0% packet loss, time 84917968ms
2022-08-10 00:00:29 rtt min/avg/max/mdev = 27.639/44.113/186.567/14.674 ms

############## annie - 08/10/22 00:25:13 EST -0500 ##############

2022-08-11 00:00:32 284 packets transmitted, 284 received, 0% packet loss, time 84919323ms
2022-08-11 00:00:32 rtt min/avg/max/mdev = 28.272/43.445/82.725/8.325 ms

############## annie - 08/11/22 00:25:16 EST -0500 ##############

2022-08-12 00:00:34 284 packets transmitted, 284 received, 0% packet loss, time 84918006ms
2022-08-12 00:00:34 rtt min/avg/max/mdev = 31.015/42.893/75.372/7.901 ms

############## annie - 08/12/22 00:25:15 EST -0500 ##############

2022-08-13 00:05:56 284 packets transmitted, 282 received, 0% packet loss, time 84941125ms
2022-08-13 00:05:56 rtt min/avg/max/mdev = 28.271/47.943/653.703/41.608 ms

############## annie - 08/13/22 00:25:14 EST -0500 ##############

2022-08-14 00:05:45 284 packets transmitted, 283 received, 0% packet loss, time 84930937ms
2022-08-14 00:05:45 rtt min/avg/max/mdev = 30.881/40.959/155.159/9.142 ms

############## annie - 08/14/22 00:25:15 EST -0500 ##############

############## annie - 08/14/22 00:25:15 EST -0500 ##############


############## annie - 08/15/22 00:25:16 EST -0500 ##############

2022-08-16 00:05:49 284 packets transmitted, 283 received, 0% packet loss, time 84933073ms
2022-08-16 00:05:49 rtt min/avg/max/mdev = 27.141/44.798/483.798/28.751 ms

############## annie - 08/16/22 00:25:14 EST -0500 ##############

2022-08-17 00:05:35 284 packets transmitted, 283 received, 0% packet loss, time 84921482ms
2022-08-17 00:05:35 rtt min/avg/max/mdev = 30.956/43.709/238.104/14.279 ms

############## annie - 08/17/22 00:25:14 EST -0500 ##############

2022-08-18 00:05:43 284 packets transmitted, 283 received, 0% packet loss, time 84928147ms
2022-08-18 00:05:43 rtt min/avg/max/mdev = 28.507/50.945/193.853/24.174 ms

############## annie - 08/18/22 00:25:17 EST -0500 ##############

2022-08-19 00:00:36 284 packets transmitted, 284 received, 0% packet loss, time 84919060ms
2022-08-19 00:00:36 rtt min/avg/max/mdev = 27.696/43.498/397.004/22.034 ms

############## annie - 08/19/22 00:25:17 EST -0500 ##############

############## annie - 08/19/22 00:25:17 EST -0500 ##############


############## annie - 08/20/22 00:25:19 EST -0500 ##############

2022-08-21 00:00:38 284 packets transmitted, 284 received, 0% packet loss, time 84919267ms
2022-08-21 00:00:38 rtt min/avg/max/mdev = 39.223/48.752/70.345/5.404 ms

############## annie - 08/21/22 00:25:19 EST -0500 ##############

2022-08-22 00:05:43 284 packets transmitted, 283 received, 0% packet loss, time 84924397ms
2022-08-22 00:05:43 rtt min/avg/max/mdev = 36.413/48.845/77.870/5.858 ms

############## annie - 08/22/22 00:25:20 EST -0500 ##############

2022-08-23 00:00:39 284 packets transmitted, 284 received, 0% packet loss, time 84919037ms
2022-08-23 00:00:39 rtt min/avg/max/mdev = 29.891/45.415/168.736/13.299 ms

############## annie - 08/23/22 00:25:16 EST -0500 ##############

2022-08-24 00:05:40 284 packets transmitted, 283 received, 0% packet loss, time 84924652ms
2022-08-24 00:05:40 rtt min/avg/max/mdev = 27.816/44.829/161.983/15.414 ms

############## annie - 08/24/22 00:25:17 EST -0500 ##############

2022-08-25 00:05:46 284 packets transmitted, 283 received, 0% packet loss, time 84929052ms
2022-08-25 00:05:46 rtt min/avg/max/mdev = 28.301/49.495/1206.182/80.846 ms

############## annie - 08/25/22 00:25:17 EST -0500 ##############

2022-08-26 00:00:37 284 packets transmitted, 284 received, 0% packet loss, time 84919324ms
2022-08-26 00:00:37 rtt min/avg/max/mdev = 29.829/44.255/80.083/8.533 ms

############## annie - 08/26/22 00:25:17 EST -0500 ##############

2022-08-27 00:05:46 284 packets transmitted, 283 received, 0% packet loss, time 84928437ms
2022-08-27 00:05:46 rtt min/avg/max/mdev = 27.374/42.090/66.567/6.831 ms

